,Text,Date,Hashtags,Location
2358,Well. If its possible since peppermint is good for lungs; get peppermint tea or candy cane. I am not a Dr. Or am I sick. Aspirin is my choice for aches pains fever headaches. Tylenol is an iffy to me. Hot bath for fever. And vitamin zinc . get well.,2020-03-31 23:49:21+00:00,,"Kilis,Turkey"
2359,"Upon diagnosis #COVID19, Don’t wait for gross expression on an X-ray Immediately w/fever spike 100°F! Keep Vitamins D3 5000iu per day C 1000mg 2x day Simultaneously start Tamiflu 30mg 2x/day Doxycycline 100mg 2x/Day Admited Ceftriaxone 1g 2x/D or NONAdmitted Keflex 500mg 2/D",2020-03-31 23:49:12+00:00,#COVID19,"Kilis,Turkey"
2360,"@DeborahBirx @JeromeAdamsMD @DrRichardCheng1 @VP What is the truth behind High Dosage Vitamin C used during Outbreak in Shanghai, China? Dr. Cheng, Medical Director of Shanghai Medical Center claims this treatment was highly effective, viz: https://youtu.be/NBbbncTR-3k",2020-03-31 23:48:47+00:00,,"Kilis,Turkey"
2361,"@biannagolodryga Speaking of Selenium heavy metal atomic #34, and building an immune system, is there good evidence showing Se can be helpful in correct dosage? Blueberries &amp; bananas appear to work well on cereal at breakfast. All vitamins B complex are urged.",2020-03-31 23:48:32+00:00,,"Kilis,Turkey"
2362,"Upon diagnosis #COVID19, Don’t wait for gross expression on an X-ray Immediately w/fever spike 100°F! Keep Vitamins #D3 5000iu per day C 1000mg 2x day Simultaneously start Tamiflu 30mg 2x/day Doxycycline 100mg 2x/Day Admited Ceftriaxone 1g 2x/D or NONAdmitted Keflex 500mg 2/D",2020-03-31 23:48:20+00:00,#COVID19 #D3,"Kilis,Turkey"
2364,"Untuk step pasien odp dan ditingkat diatsnya umum digunakan praktisi kesehatan dunia ,diawali dengn mengkover vitamin c dahulu....hidrokloro,digunakan tatkala sudah demam baru masuk ditahap penggunaan",2020-03-31 23:48:20+00:00,,"Kilis,Turkey"
2365,"UIN Syarif Hidayatullah sediakan makanan, buah, dan vitamin bagi mahasiswanya yang berasal dari luar kota dan saat ini masih tinggal di sekitar Ciputat, Tangsel. UIN Syahid Sediakan Makanan, Buah dan Vitamin bagi Mahasiswa Rantau Terdampak Covid-19 https://kemenag.go.id/berita/read/513102/uin-syahid-sediakan-makanan--buah-dan-vitamin-bagi-mahasiswa-rantau-terdampak-covid-19",2020-03-31 23:48:14+00:00,,"Kilis,Turkey"
2366,New York hospitals treating coronavirus patients with vitamin C ,2020-03-31 23:48:09+00:00,,"Kilis,Turkey"
2367,My quatantine so far: Makan cukup Asupan vitamin Tidur cukup ,2020-03-31 23:47:54+00:00,,"Kilis,Turkey"
2368,you'll get it when cis people are murdered for just being cis. until then shut up and eat sand,2020-03-31 23:47:53+00:00,,"Kilis,Turkey"
2369,♪。.:＊・゜ 見せつけるように 囁くように 私を照らすの あなたは私のVitamin とってもキラキラしてるの ♡Crystal/A Pink♡,2020-03-31 23:47:53+00:00,,"Kilis,Turkey"
2370,"15. Plug: If you feel sick get you some soup, vitamin C, so ginger hibiscus tea Leon: The hell is hibiscus? a cousin to the Bojangles biscuit? If so I fuckssss with it. Plug: Look call me 8am not 8:01 not 8:05. If you don't have jello and you call me ima kill you and larry.",2020-03-31 23:47:50+00:00,,"Kilis,Turkey"
2371,"Oh no! If shopping online is an option, you can find our products on our website (U.S.), Amazon, Thrive Market, Vitacost, and Lucky Vitamin. We hope this helps!",2020-03-31 23:47:41+00:00,,"Kilis,Turkey"
2372,Vitamin D and immunity https://youtu.be/W5yVGmfivAk via @YouTube,2020-03-31 23:47:34+00:00,,"Kilis,Turkey"
2373,"Pt 2 , because rn your skin is derived from vitamin D because foundation more than often contains SPF and plus it helps clear up acne scars and really shows a lot of improvement on your skin !!! Trust me !! Sun and water sis .",2020-03-31 23:47:21+00:00,,"Kilis,Turkey"
2374,Yea..the vitamin c is for cognac ,2020-03-31 23:47:21+00:00,,"Kilis,Turkey"
2375,"back to normal....semua nya jalanan rame transjakarta rame juga....ujung2 semua butuh makan dan hidup...jaga kesehatan minum vitamin, jaga jarak, jaga kebersihan...please be safe....",2020-03-31 23:47:20+00:00,,"Kilis,Turkey"
2376,COVID 19 (C) Cuci tangan/wudhu (O) Olahraga (V) Vitamin (I) Ikhtiar (D) Do’a (19) 2 Subuh + 4 Dzuhur + 4 Ashar + 3 Maghrib + 4 Isya + 2 Tahajud,2020-03-31 23:47:08+00:00,,"Kilis,Turkey"
2377,"And vitamins. The do something, right?",2020-03-31 23:47:08+00:00,,"Kilis,Turkey"
2378,Vitamin eksikliği olmayan kaldı mı ya,2020-03-30 20:46:10+00:00,,"Kocaeli,Turkey"
2379,Did You see it? http://www.reddeergames.com Let the fun begin! #Xbox #NintendoSwitch #Playstation,2020-08-12 21:24:19+00:00,#Xbox #NintendoSwitch #Playstation,"Kocaeli,Turkey"
2380,Şimdi burada çok şey söylemek isterdim ama gidip meyve yemem gerekiyor Vitamin şart,2020-03-30 19:42:46+00:00,,"Kocaeli,Turkey"
2381,"Zinde ve enerjik bir gün için en güzel destek, erkeklere özel dizayn edilmiş Herbalife Nutrition Vitamin ve Mineral Kompleks Tablet! . https://idealbeslen.com/urun/herbalife-erkek-vitamini/ . #pazartesi #vitamins #minerals #zindelik – at Bağımsız Herbalife Üyesi 0536 612 9009",2020-03-30 08:02:39+00:00,#pazartesi #vitamins #minerals #zindelik,"Kocaeli,Turkey"
2382,Kanka 5 dakika önce baktım öyle vitamin yokmuş bende b yaptım:( ,2020-03-29 19:14:47+00:00,,"Kocaeli,Turkey"
2383,Uzmanlar bol meyve sebze yiyin diyor.. ama size tavsiyem yerli turuncgilleri tercih edin. Bunun gibi Washington portakallarını yemeyin. Bunların vitamin değeri düşük. Maazallah kansızlık yapabilir. ,2020-03-25 14:31:17+00:00,,"Kocaeli,Turkey"
2384,"Vitaminli gıdalar tüketin, bağışıklığınızı güçlendirin Taze meyve ve sebze için şubemize bekliyoruz #market #indirim #uygunfiyat #kalite #taze #sebze #meyve #kocaeli #vitamin #pazar @Şirinköy, Gölcük https://www.instagram.com/p/B91E8l1F8PA/?igshid=171kehgwgwe5b",2020-03-17 09:14:47+00:00,#market #indirim #uygunfiyat #kalite #taze #sebze #meyve #kocaeli #vitamin #pazar,"Kocaeli,Turkey"
2385,"Herbalife Vitamin ve Mineral Kompleks, gün içinde enerjinize tam destek! . http://www.idealbeslen.com – at Bağımsız Herbalife Üyesi 0536 612 9009",2020-02-06 18:16:40+00:00,,"Kocaeli,Turkey"
2386,Polemiği başlatan sendin diyorsun ilk mesajı atan sendin diyorum işine bak diyorsun dayıcım bol bol vitamin al balık ye hafızanı güçlendir yakında eşini dostunu unutursun huzurevine gönderirler seni ,2020-02-05 15:56:59+00:00,,"Kocaeli,Turkey"
2387,"6-uygulanması, vücut için gereken protein, karbonhidrat ve yağların yanı sıra, vitamin, mineral ve elektrolitlerin de yeterli miktarda (yani ne az ne de fazla) alınmış olması koşuluyla. Eğer vücudu 16 saat aç bırakmanın metabolizmayı dengeye kavuşturmak için yeterli olduğunu ...",2020-02-02 21:55:15+00:00,,"Kocaeli,Turkey"
2388,"Nerden bilsin , o zaman ya bebektir ya vitamin .Olmadı Cahil! Yardım talebini kurumlar kriz anında değil varsa ihtiyacı önlem veya hazırlık amaçlı talep eder.",2020-01-25 08:19:53+00:00,,"Kocaeli,Turkey"
2389,ciltlerini parlatıyordur kesin dklwxkw ya YARASADA nasıl bir vitamin ya da yararlı herhangi bir şey olabilir,2020-01-23 20:55:01+00:00,,"Kocaeli,Turkey"
2390,22 vitamin mineral içeren kahvaltım ve ben aşk yaşıyoruz – at İzmit Çarşı,2020-01-08 06:55:34+00:00,,"Kocaeli,Turkey"
2391,Cildin ihtiyacı olan vitamin ve minerallerle cildi destekliyorlar tek seanslık 1 işlem ama harika sonuçları var botoxs uygulamalarına gençlik aşısına sıcak bakmayan biriyim bu uygulama daha canlı bir cilt ve mimik kaybı olmayan bir uygulama,2019-12-20 16:33:49+00:00,,"Kocaeli,Turkey"
2392,Sivilce lekelerini sivilceleride yok ediyor cilde aydınlık bi görüntü veriyor kaz ayaklarınıda baya hafifletiyor not 41 yaşındayım maddi durumunuz iyiyse @linemed_estetik vitamin detoxsunada bir bakın derim instagramda,2019-12-20 16:24:36+00:00,,"Kocaeli,Turkey"
2393,Önemli#sağlık#Vitamin#Bkompleks#ersağ#http://www.ersagkocaeli.com,2019-09-10 22:46:43+00:00,,"Kocaeli,Turkey"
2394,Terbiye sınırlarını aşmıyıoruz.. O marş yazıldığın da vitamin değildin... Sevmeye bilirsin... Saygı duymayı ve alakan olmayan konulara yorum yapmamayı bilmelisin...,2019-07-20 07:35:54+00:00,,"Kocaeli,Turkey"
2395,Efsane lezzet çıtır bilen bilir Yumurtalarımız marketten aldığınız yumurtalardan çok daha fazla vitamin/protein kaynağına sahiptir.Yemesi keyifli ve kokusuz lezzetlidir. #yemek #yemektarifi #yemektarifleri #mutfak… https://www.instagram.com/p/Bz74jB6FtZZ/?igshid=nmn9ucqxucl5,2019-07-15 11:26:41+00:00,#yemek #yemektarifi #yemektarifleri #mutfak,"Kocaeli,Turkey"
2396,Hasat zamanı Yumurtalarımız marketten aldığınız yumurtalardan çok daha fazla vitamin/protein kaynağına sahiptir.Yemesi keyifli ve kokusuz lezzetlidir. #yemek #yemektarifi #yemektarifleri #mutfak #yumurta #organik… https://www.instagram.com/p/Bz5wUUWFz9e/?igshid=ot29niqqy8be,2019-07-14 15:36:19+00:00,#yemek #yemektarifi #yemektarifleri #mutfak #yumurta #organik,"Kocaeli,Turkey"
2397,"Eğer yumurta kaliteli ise yemeye,lezzete doyulmaz... Yumurtalarımız marketten aldığınız yumurtalardan çok daha fazla vitamin/protein kaynağına sahiptir.Yemesi keyifli ve kokusuz lezzetlidir. #yemek #yemektarifi… https://www.instagram.com/p/Bz5R2jdl2_f/?igshid=1vk9nrbc8adub",2019-07-14 11:10:06+00:00,#yemek #yemektarifi,"Kocaeli,Turkey"
2398,Magnezyum eksik sende az vitamin al,2019-07-05 16:51:03+00:00,,"Kocaeli,Turkey"
2399,Doğru ve dengeli bir kahvaltı istiyorsan güne Herbalife shake ile başla! http://www.idealbeslen.com 05366129009 whatsapp #kahvaltı #dengeli #doğru #besleyici #enerji #iyi #sabah #lezzet #kilo #protein #sakarya #adapazarı #vitamin #mineral #kocaeli #izmit #şahane – at Şen İş Merkezi,2019-06-25 08:27:58+00:00,#kahvalt #dengeli #do #besleyici #enerji #iyi #sabah #lezzet #kilo #protein #sakarya #adapazar #vitamin #mineral #kocaeli #izmit,"Kocaeli,Turkey"
2401,"Herbalife Formül 1 Shakeinizi, Çilek ile tatlandırmanın tam zamanı! http://www.idealbeslen.com 05366129009 whatsapp #shake #besleyici #enerji #doğru #karbonhidrat #destek #protein #vitamin #mineral #destek #kilo #zayıflamak #form #herbalife #herbalifenutrition #herbalifetürkiye – at Kartallar Beslenme Ofisi",2019-05-31 10:37:08+00:00,#shake #besleyici #enerji #do #karbonhidrat #destek #protein #vitamin #mineral #destek #kilo #zay #form #herbalife #herbalifenutrition #herbalifet,"Kocaeli,Turkey"
2402,Ben de anlıyordum ama b12 eksikliğimin olduğunu sürekli vitamin hapları içiyordum spor yaparken de çok hap kullandım vücudu boş bırakınca böyle eksiklikler başladı ,2019-05-22 21:29:24+00:00,,"Kocaeli,Turkey"
2403,"Banu Alkan saçlarını boyatmaya Paris'e gidememiş, yalisinin mazotunu alamamış yokluk çekmiş kadın. İlkokuldayken vitamin olsun diye Malibu içerdim Süt Malibu. Şimdi EYT bekliyorum. Hayat ",2019-05-20 19:21:44+00:00,,"Kocaeli,Turkey"
2404,"Herbalife Formül 1 Shake' ine, hurma kat ve şahane lezzeti tat! http://www.idealbeslen.com 05366129009 whatsapp #hurma #shake #besleyici #enerji #doğru #karbonhidrat #destek #protein #vitamin #mineral #lezzetli #dengeli #ramazan #oruç #sahur #iftar – at Kartallar Beslenme Ofisi",2019-05-14 08:23:47+00:00,#hurma #shake #besleyici #enerji #do #karbonhidrat #destek #protein #vitamin #mineral #lezzetli #dengeli #ramazan #oru #sahur #iftar,"Kocaeli,Turkey"
2405,O çoktan portakaldaki vitamin evresinden çıktı bile hocam,2019-05-08 07:24:02+00:00,,"Kocaeli,Turkey"
2406,Yeni bir güne Herbalife kahvaltısı ile merhaba deyin! http://www.idealbeslen.com 05366129009 whatsapp #cuma #mübarek #kahvaltı #dengeli #doğru #besleyici #enerji #iyi #sabah #lezzet #kilo #protein #vitamin #mineral #destek – at Bağımsız Herbalife Üyesi 0536 612 9009,2019-05-03 08:17:10+00:00,#cuma #m #kahvalt #dengeli #do #besleyici #enerji #iyi #sabah #lezzet #kilo #protein #vitamin #mineral #destek,"Kocaeli,Turkey"
2407,Ihmal etme ilaçlarını bol sıvı tüket vitamin olarak tez zamanda iyi olursun işallah,2019-04-26 17:14:45+00:00,,"Kocaeli,Turkey"
2408,"Güne doğru ve dengeli bir kahvaltı olan, Herbalife Shake ile başlayın! http://www.idealbeslen.com 05366129009 whatsapp #kahvaltı #dengeli #doğru #besleyici #enerji #iyi #sabah #lezzet #kilo #protein #vitamin #mineral #karbonhidrat #lif #destek – at Herbalife Kartallar Beslenme Ofisi",2019-04-16 06:17:12+00:00,#kahvalt #dengeli #do #besleyici #enerji #iyi #sabah #lezzet #kilo #protein #vitamin #mineral #karbonhidrat #lif #destek,"Kocaeli,Turkey"
2409,"Folat (B9 Vitamini), vücutta amino asit sentezi ve kan oluşumuna katkıda bulunur! http://www.idealbeslen.com 05366129009 whatsapp #folat #B9vitamini #B9 #vitamin #aminoasit #sentez #kan #body #vücut",2019-04-15 10:25:03+00:00,#folat #B9vitamini #B9 #vitamin #aminoasit #sentez #kan #body #v,"Kocaeli,Turkey"
2410,Bahar Yorgunluğuna Dikkat! http://www.idealbeslen.com #baharyorgunluğu #vitamin #mineral #destek #enerji #bağışıklık #kompleks #takviye #B #bitkisel #hayvansal #bahar #mevsim #ilkbahar #yorgunluk,2019-04-08 13:51:03+00:00,#baharyorgunlu #vitamin #mineral #destek #enerji #ba #kompleks #takviye #B #bitkisel #hayvansal #bahar #mevsim #ilkbahar #yorgunluk,"Kocaeli,Turkey"
2411,"A Vitamini, cildin korunmasına, bağışıklık sistemine ve görme yetisine destek olur! http://www.idealbeslen.com 05366129009 whatsapp #A #Avitamini #vitamin #mineral #destek #enerji #bağışıklık #cilt #deri #metabolizma #görme #göz – at Bağımsız Herbalife Üyesi 0536 612 9009",2019-04-01 10:08:46+00:00,#A #Avitamini #vitamin #mineral #destek #enerji #ba #cilt #deri #metabolizma #g #g,"Kocaeli,Turkey"
2412,"Sabah işe giderken kahvaltı etmeye vaktin yoksa, Herbalife Formül 1 shake en iyi çözüm! http://www.idealbeslen.com 05366129009 whatsapp #kahvaltı #dengeli #doğru #besleyici #enerji #iyi #sabah #lezzet #kilo #protein #vitamin #mineral #beğen #öğün #iş #güç #job",2019-03-26 11:04:56+00:00,#kahvalt #dengeli #do #besleyici #enerji #iyi #sabah #lezzet #kilo #protein #vitamin #mineral #be #i #g #job,"Kocaeli,Turkey"
2413,Herbalife Formül 1 shake' ini meyveler ile tatlandır ve spor sonrası kendine ödül ver. http://www.idealbeslen.com 05366129009 whatsapp #shake #besleyici #enerji #doğru #karbonhidrat #destek #protein #vitamin #mineral #sporsonrası #sports #spor #egzersiz #sporcu – at Bağımsız Herbalife Üyesi 0536 612 9009,2019-03-25 12:07:30+00:00,#shake #besleyici #enerji #do #karbonhidrat #destek #protein #vitamin #mineral #sporsonras #sports #spor #egzersiz #sporcu,"Kocaeli,Turkey"
2414,"Sizi doğru ve dengeli beslemek için, rengarenk Herbalife Shakeler hazır! http://www.idealbeslen.com 05366129009 whatsapp #shake #besleyici #enerji #doğru #karbonhidrat #destek #protein #vitamin #mineral #beğen #çikolatalı #fındıklı #vanilyalı – at Kartallar Beslenme Ofisi",2019-03-22 09:22:33+00:00,#shake #besleyici #enerji #do #karbonhidrat #destek #protein #vitamin #mineral #be #f #vanilyal,"Kocaeli,Turkey"
2415,Çay için rota oluşturulsun Bekliyoruz efenim Güneşte bizimle bugün vitamin saçıyor miss @Sütlü Çardak https://www.instagram.com/p/BvOVMnZHjOeudtvkt1O9ill1ReAJnGc6MWMwXQ0/?utm_source=ig_twitter_share&amp;igshid=5cl5vze5aj5z,2019-03-20 08:46:25+00:00,,"Kocaeli,Turkey"
2416,Gün içinde enerjim hiç düşmesin diyorsan! http://www.idealbeslen.com 05366129009 whatsapp #vitamin #enerji #inositol #taurin #guarana #kafein #cvitamini #B12 #B6 #direnç #aktif #kalite #keyif #liftoff – at İzmit Çarşı,2019-03-19 08:56:04+00:00,#vitamin #enerji #inositol #taurin #guarana #kafein #cvitamini #B12 #B6 #diren #aktif #kalite #keyif #liftoff,"Kocaeli,Turkey"
2417,"Herbalife Formül 2 Vitamin ve Mineral Kompleks, günlük vitamin , mineral desteğine ihtiyaç duyduğunuzda yanınızda! http://www.idealbeslen.com 05366129009 whatsapp #vitamin #mineral #destek #enerji #bağışıklık #kompleks #takviye #günlük #kadınvitamini #erkekvitamini – at Bağımsız Herbalife Üyesi 0536 612 9009",2019-03-17 08:45:12+00:00,#vitamin #mineral #destek #enerji #ba #kompleks #takviye #g #kad #erkekvitamini,"Kocaeli,Turkey"
2418,"Herbalife Formül 1 Sport, Aminoasit içeren ve porsiyon başına 18 gr. süt proteini sağlayan sporcu gıdasıdır. http://www.idealbeslen.com 05366129009 whatsapp #süt #protein #vitamin #mineral #destek #enerji #sporcu #supplement #kazein #aminoasit #gıda #beslenme #sport #spor – at Kartallar Beslenme Ofisi",2019-03-16 10:28:54+00:00,#s #protein #vitamin #mineral #destek #enerji #sporcu #supplement #kazein #aminoasit #g #beslenme #sport #spor,"Kocaeli,Turkey"
2419,"C Vitamini, zindelik verir, bağışıklık sistemi ve kemikler için gerekli kollajen üretimine destek olur. http://www.idealbeslen.com 05366129009 whatsapp #C #cvitamini #bağışıklık #kompleks #takviye #kollajen #zindelik #vitamins #minerals #destek #enerji #iyi",2019-03-12 08:51:53+00:00,#C #cvitamini #ba #kompleks #takviye #kollajen #zindelik #vitamins #minerals #destek #enerji #iyi,"Kocaeli,Turkey"
2420,Hayırlı Haftalar Dileriz Yumurtalarımız marketten aldığınız yumurtalardan çok daha fazla vitamin/protein kaynağına sahiptir.Yemesi keyifli ve kokusuz lezzetlidir. #yemek… https://www.instagram.com/p/Bu3ip9VgVyw/?utm_source=ig_twitter_share&amp;igshid=9ohfcebm515o,2019-03-11 12:23:43+00:00,#yemek,"Kocaeli,Turkey"
2422,Hayırlı Cumalar Dileriz Yumurtalarımız marketten aldığınız yumurtalardan çok daha fazla vitamin/protein kaynağına sahiptir.Yemesi keyifli ve kokusuz lezzetlidir. #yemek… https://www.instagram.com/p/Buvq--thH9T/?utm_source=ig_twitter_share&amp;igshid=1py3ox8yyrg6v,2019-03-08 11:00:20+00:00,#yemek,"Kocaeli,Turkey"
2423,Güzel bir güne merhaba Yumurtalarımız marketten aldığınız yumurtalardan çok daha fazla vitamin/protein kaynağına sahiptir.Yemesi keyifli ve kokusuz lezzetlidir. #yemek #yemektarifi… https://www.instagram.com/p/BuvqoYkBo9v/?utm_source=ig_twitter_share&amp;igshid=7ckvwjgp5ooj,2019-03-08 10:58:00+00:00,#yemek #yemektarifi,"Kocaeli,Turkey"
2424,Kar yağdığında daha güzel Yumurtalarımız marketten aldığınız yumurtalardan çok daha fazla vitamin protein kaynağıdır.yemesi hafif ve kokusuz lezzetlidir. #yemek #yemektarifi… https://www.instagram.com/p/Bui7HO0B12P/?utm_source=ig_twitter_share&amp;igshid=1o3p864hyr6zq,2019-03-03 12:11:09+00:00,#yemek #yemektarifi,"Kocaeli,Turkey"
2425,Tamamen doğal gezen tavuk yumurtalarımız sizleri bekliyor.her zaman taze ve günlük.Organik yumurta yemediyseniz tadına baktıktan sonra vazgeçemeyeceğiniz lezzetle vitamin deposu sizleri… https://www.instagram.com/p/BoCEaaJH4XR/?utm_source=ig_twitter_share&amp;igshid=1844kx70pf9c5,2018-09-22 14:50:57+00:00,,"Kocaeli,Turkey"
2426,"Küçük olduğuna bakmayın. İçinde onlarca çay,kahve ve soğuk içecek çeşitleri ile vitamin var. Yazın en sıcak anlarında,hararetinizi atmak istediğinizde Duble Çay sizleri bekliyor olacak.… https://www.instagram.com/p/BkiLzbdhxdK/?utm_source=ig_twitter_share&amp;igshid=1s2kfswsjn99q",2018-06-27 16:04:15+00:00,,"Kocaeli,Turkey"
2427,"Vitamin eksikliği @Derince, Kocaeli, Turkey https://www.instagram.com/p/Bb07z-hlNhv/",2017-11-23 06:07:07+00:00,,"Kocaeli,Turkey"
2428,guten morgen (@Vitamin Durağı) https://www.swarmapp.com/c/ldAiqh6H2EC,2017-04-14 06:39:14+00:00,,"Kocaeli,Turkey"
2429,Güzellik bizim işimiz omega 3.6 vitamin maskemizle yaza hazırlık… https://www.instagram.com/p/BRf2Yu6BVDUF5N2EnOItfZq2D1gOwe3lXuIKKA0/,2017-03-11 12:21:40+00:00,,"Kocaeli,Turkey"
2430,"Günaayydın bu sabaha yeni bir QEnzim, vitamin ve minarel gıda takviyesi Medigard ile tanışarak… https://www.instagram.com/p/BQznUXGhYBc/",2017-02-22 08:03:28+00:00,,"Kocaeli,Turkey"
2431,"Gereksiz panik yapmayın, ucuz medya provokasyonlarına kanmayın. Dünyanın sonu gelmiş gibi medikal malzeme, ilaç, gıda maddesi stoklamayın. Kişisel hijyeninize dikkat edin, iyi gıdalar ve vitamin-minerallerle bağışıklık sisteminizi güçlü tutun ve hayatınızı yaşayın..., ",2020-03-11 19:29:40+00:00,,"Konya,Turkey"
2432,Did You see it? http://www.reddeergames.com Let the fun begin! #Xbox #NintendoSwitch #Playstation,2020-08-12 21:24:19+00:00,#Xbox #NintendoSwitch #Playstation,"Konya,Turkey"
2433,"Ameliyattan sonra yeni toparlanan kedimiz iki ay sonra eve çıktı... Bir kanaviçeden yatak örtüsü sermediğimiz kaldı köşeye Anne kediye tırnak törpüsü,anne kediye vitamin mâcunu,anne kedi hastalanacak kombiyi yak derken 600 lira fatura geldi. Sonuç;Kediye sanayide iş bakıyoruz ",2020-03-09 19:41:37+00:00,,"Konya,Turkey"
2434,EĞİTİM ÖZEL GELECEK GÜZEL OLSUN projemizin 1.Etkinligi C Vitamin Senligini gerceklestirdik.Bol vitaminli gunlerimiz olsun @konyamem @SeyitAliBuyuk @servetal61 @selcukluilcemem @TuranKAYACILAR @HakanBozda14 @Konya2023ElEle @MustafaKurt2016 @OkanTekkalan @msamikoc,2020-03-05 07:24:35+00:00,,"Konya,Turkey"
2435,"Kokusu ve Lezzeti ile Büyüleyen Padişah Siyah Zeytin Dalından toplanıp sofranıza gelene kadar her aşamasında özen ve emek verilen, vitamin yönünden zengin, Padişah zeytin iri ve etli yapısıyla ağzınıza layık. İri… https://www.instagram.com/p/B9JbHdRFD80/?igshid=kb0dk172g0lt",2020-02-29 10:21:27+00:00,,"Konya,Turkey"
2436,indirimde diye ton baligi aldim saglik vitamin felan hikaye..fitness mitness felan hak getire zaten neyse hamsi vardi da biz mi almadik,2020-02-25 11:44:56+00:00,,"Konya,Turkey"
2437,"Kız istemeye gelmişler kahvenin içine tuz atıyor yelloz, beni istemeye gelseler kahveye vitamin koyarım güçlensin yiğidim.",2020-02-24 06:04:17+00:00,,"Konya,Turkey"
2438,"Protein ve vitamin alıp, düzenli spor yapıp ve stresten de olabildiğince uzak duruyorlarsa vs. ",2020-01-04 15:09:57+00:00,,"Konya,Turkey"
2439,"Bilime Açılan Penceremizde “Gebelikte Vitamin ve Mineral Kullanimina Güncel Yaklasim, Ne Kadar Gerekli?” konulu konferansımızı gercekleştirdik. Bu konferansı düzenleyen, Prof. Dr. Şerefnur Öztürk hocama ve katılan tüm hoca ve meslektaşlarıma teşekkürler... ",2019-12-16 16:39:27+00:00,,"Konya,Turkey"
2440,Eczanden vitamin al gündüz için gece de kahve ,2019-11-05 19:17:04+00:00,,"Konya,Turkey"
2441,Dermanını dost diye yazmis sanirim. Sayin vitamin ,2019-09-27 18:49:09+00:00,,"Konya,Turkey"
2442,umut edebilmek ve belki de bir parça gülebilmekti bulabildiğimiz tek vitamin.,2019-08-30 22:25:32+00:00,,"Konya,Turkey"
2443,B12 vitamin eksikliğinden sanırım kin tutamıyorum,2019-08-07 22:31:12+00:00,,"Konya,Turkey"
2444,"Geçmiş olsun @SavunanMeczup . Bi ara Gülceye uğrarsan, konuşalım vitamin işini . Sebze meyve , yaparız ortaya karışık ",2019-07-12 21:27:04+00:00,,"Konya,Turkey"
2445,"Simit değilde protein,vitamin içeren türlü yiyecekler yeyip düşünen insanlar olmak mı istiyorsunuz. Üç öğün simit önerisi ekonomi için değil. Sadece simit ye çok düşüneme!",2019-04-19 14:13:55+00:00,,"Konya,Turkey"
2446,"Güne yeni bir alışkanlık; #günlüksüt servisi! Gerçek vitamin ve mineralli, besleyici ve ""Hastalıktan Ari"" belgeli #süt ile iyiliği sofralarınızda hissedin! Katkı maddesi ve koruyucu içermeyen, el değmeden hazırlanan #HacıbayGünlükSüt ile her damlada tazeliğin tadını çıkarın!",2019-03-25 10:40:51+00:00,#g #s #Hac,"Konya,Turkey"
2447,Gençlik Anaokulumuzda Vitamin Şenliği ... @Gençlik Eğitim Kurumları https://www.instagram.com/p/BrTRFGtBS6g8kKpD-frLSY_fGh4pVmnTHGxQuk0/?utm_source=ig_twitter_share&amp;igshid=1ayg1po1hohy5,2018-12-12 20:41:07+00:00,,"Konya,Turkey"
2448,I'm at Vitamin Börek Ve Mantı in Konya w/ @ahmetmelihaksu,2018-09-02 15:13:42+00:00,,"Konya,Turkey"
2449,Dondurma doğru şartlarda üretildiğinden tam bir vitamin ve mineral… https://www.instagram.com/p/BiEx7fCAeKO/,2018-04-27 12:57:00+00:00,,"Konya,Turkey"
2450,I'm at Vitamin Börek Ve Mantı in Konya https://www.swarmapp.com/c/ayd5wGnQZ3B,2017-12-31 09:36:25+00:00,,"Konya,Turkey"
2451,"SIPARIŞINIZI HEMEN VERIN!05326675170 #konya #vitamin #saglikliyasam @Konya, Turkey https://www.instagram.com/p/Bco1TGVnh8G/",2017-12-13 09:50:43+00:00,#konya #vitamin #saglikliyasam,"Konya,Turkey"
2452,Kahvalti zamanı (@Vitamin Börek Ve Mantı in Konya) https://www.swarmapp.com/c/a49vQrkVYRa,2017-02-04 08:48:27+00:00,,"Konya,Turkey"
2453,Vitamin şart (@Meyvelium in Konya) https://www.swarmapp.com/c/2qbH7Bf4wfA,2017-01-11 13:03:53+00:00,,"Konya,Turkey"
2454,I'm at Vitamin Börek Ve Mantı in Konya https://www.swarmapp.com/c/fBKLIwUxyqT,2017-01-01 09:57:59+00:00,,"Konya,Turkey"
2455,iPhoneに不審なカレンダー通知が表示される手口発生 対策を紹介 (ライブドアニュース) https://news.line.me/issue/oa-livedoornews/y0p9lon8jbpo?utm_source=Twitter&amp;utm_medium=share&amp;utm_campaign=none #linenews,2020-03-31 23:59:55+00:00,#linenews,"Kütahya,Turkey"
2456,Did You see it? http://www.reddeergames.com Let the fun begin! #Xbox #NintendoSwitch #Playstation,2020-08-12 21:24:19+00:00,#Xbox #NintendoSwitch #Playstation,"Kütahya,Turkey"
2457,"Be sensible. Take care of yourself. Vitamin A, D fruits vegtables, drink water, get proper rest. Watch where you go, watch who is around you. Common sense!!",2020-03-31 23:59:46+00:00,,"Kütahya,Turkey"
2458,何だこりゃ！？ 外国人抜けば大したことないではないですか。,2020-03-31 23:59:44+00:00,,"Kütahya,Turkey"
2459,"I thought it was a hoax but people keep dying everyone stay safe and take vitamins, if you don’t have any go get some. all you have to do is keep your body healthy for 2 months stay calm and we’ll make it ",2020-03-31 23:59:09+00:00,,"Kütahya,Turkey"
2460,Maneh juga jangan lupa sarapan sama minum vitamin ya biar nggak ngedrop ,2020-03-31 23:58:59+00:00,,"Kütahya,Turkey"
2461,Intaking my vitamin ,2020-03-31 23:58:52+00:00,,"Kütahya,Turkey"
2462,Literally no better way to get Vitamin D.,2020-03-31 23:58:48+00:00,,"Kütahya,Turkey"
