,Text,Date,Hashtags,Location
768,I'm at Eti Guzel Vitamin Bar in Balıkesir https://www.swarmapp.com/c/fJKxp10IB6k,2019-02-11 16:11:05+00:00,,"Balıkesir,Turkey"
769,I'm at Eti Guzel Vitamin Bar in Balıkesir https://www.swarmapp.com/c/aFBg3VuaRAe,2019-01-14 19:30:54+00:00,,"Balıkesir,Turkey"
770,I'm at Eti Guzel Vitamin Bar in Balıkesir https://www.swarmapp.com/c/apbrw8MA4bm,2019-01-09 20:38:48+00:00,,"Balıkesir,Turkey"
771,I'm at Eti Guzel Vitamin Bar in Balıkesir https://www.swarmapp.com/c/2FJ4izIPtpA,2019-01-03 16:21:52+00:00,,"Balıkesir,Turkey"
772,I'm at Eti Guzel Vitamin Bar in Balıkesir https://www.swarmapp.com/c/iGyFp0jFoSX,2019-01-02 07:24:13+00:00,,"Balıkesir,Turkey"
773,I'm at Eti Guzel Vitamin Bar in Balıkesir https://www.swarmapp.com/c/ar108viM92N,2018-12-31 08:11:00+00:00,,"Balıkesir,Turkey"
774,Ben yaparım da güzel olmaz mı? (@Eti Guzel Vitamin Bar in Balıkesir) https://www.swarmapp.com/c/b2hpo6Nh9on,2018-12-29 15:58:53+00:00,,"Balıkesir,Turkey"
775,I'm at Eti Guzel Vitamin Bar in Balıkesir ,2018-12-28 16:23:19+00:00,,"Balıkesir,Turkey"
776,I'm at Eti Guzel Vitamin Bar in Balıkesir https://www.swarmapp.com/c/aOJ7SRDuDZs,2018-12-28 07:17:39+00:00,,"Balıkesir,Turkey"
777,I'm at Eti Guzel Vitamin Bar in Balıkesir https://www.swarmapp.com/c/4sIeDyVxItt,2018-12-27 15:28:25+00:00,,"Balıkesir,Turkey"
778,I'm at Eti Guzel Vitamin Bar in Balıkesir https://www.swarmapp.com/c/9QUjqkXfiE2,2018-12-27 09:33:12+00:00,,"Balıkesir,Turkey"
779,Çay var çayyy (@Eti Guzel Vitamin Bar in Balıkesir) https://www.swarmapp.com/c/bZhpAEXu6EZ,2018-12-27 07:30:54+00:00,,"Balıkesir,Turkey"
780,"ekip a.c. (@Gül Fast Food & Vitamin Büfe in Balıkesir, Merkez) https://www.swarmapp.com/c/fRuzvlpo6bt",2017-08-02 13:28:55+00:00,,"Balıkesir,Turkey"
781,Netflix ve dev ekran Vitamin ve omega hapları Tiroid ve alerji ilaçları stoğu Sıra geldiiiii kitap stoğuna ,2020-03-17 22:33:12+00:00,,"Bartın,Turkey"
782,Solgar Vitamin Erkekler Türkiye Kupası şampiyonu @FBBasketbol ,2020-02-16 16:44:20+00:00,,"Batman,Turkey"
783,"Nush ile uslanmayanı etmeli tekdir; tekdir ile uslanmayanın hakkı kötektir"" Kas gevşetici olup güzel vitamin verir Gezerken ailecek ilgimizi çekti bazen döverken karşıdaki taş kafalı… https://www.instagram.com/p/BnynDA8nD2K/?utm_source=ig_twitter_share&amp;igshid=1e1e97u746lgc",2018-09-16 14:53:11+00:00,,"Batman,Turkey"
784,İlimiz Merkez İlçe Şeyh Edebali Üniversitesi Anaokulu’nda Vitamin Şenliği Etkinliği Gerçekleştirildi ,2019-12-25 08:59:01+00:00,,"Bilecik,Turkey"
785,#shotoniphone #blue #sky #sunset #lake #green #flowers #shadow #nature #photooftheday #instagood… https://www.instagram.com/p/BYBXMFlAk2R/,2017-08-20 15:51:38+00:00,#shotoniphone #blue #sky #sunset #lake #green #flowers #shadow #nature #photooftheday #instagood,"Bilecik,Turkey"
786,iPhoneに不審なカレンダー通知が表示される手口発生 対策を紹介 (ライブドアニュース) https://news.line.me/issue/oa-livedoornews/y0p9lon8jbpo?utm_source=Twitter&amp;utm_medium=share&amp;utm_campaign=none #linenews,2020-03-31 23:59:55+00:00,#linenews,"Bingöl,Turkey"
787,Did You see it? http://www.reddeergames.com Let the fun begin! #Xbox #NintendoSwitch #Playstation,2020-08-12 21:24:19+00:00,#Xbox #NintendoSwitch #Playstation,"Bingöl,Turkey"
788,"Be sensible. Take care of yourself. Vitamin A, D fruits vegtables, drink water, get proper rest. Watch where you go, watch who is around you. Common sense!!",2020-03-31 23:59:46+00:00,,"Bingöl,Turkey"
789,何だこりゃ！？ 外国人抜けば大したことないではないですか。,2020-03-31 23:59:44+00:00,,"Bingöl,Turkey"
790,"I thought it was a hoax but people keep dying everyone stay safe and take vitamins, if you don’t have any go get some. all you have to do is keep your body healthy for 2 months stay calm and we’ll make it ",2020-03-31 23:59:09+00:00,,"Bingöl,Turkey"
791,Maneh juga jangan lupa sarapan sama minum vitamin ya biar nggak ngedrop ,2020-03-31 23:58:59+00:00,,"Bingöl,Turkey"
792,Intaking my vitamin ,2020-03-31 23:58:52+00:00,,"Bingöl,Turkey"
793,Literally no better way to get Vitamin D.,2020-03-31 23:58:48+00:00,,"Bingöl,Turkey"
794,Everything will be ok! Add some vitamin C and zinc into the tea/ water whatever... every little help is welcome... all the best,2020-03-31 23:58:36+00:00,,"Bingöl,Turkey"
795,Listen I understand,2020-03-31 23:58:29+00:00,,"Bingöl,Turkey"
796,Well...It is an excellent source of vitamin and and it has no preservatives. ,2020-03-31 23:58:22+00:00,,"Bingöl,Turkey"
797,"#traveltuesday Sister trip to Myrtle Beach, SC. Need to make a trip soon to the ocean. I need some vitamin Sea! #wander_explore_experience #travel #southcarolina #beach #vitaminsea @Myrtle Beach, South Carolina https://www.instagram.com/p/B-atP1UJ-gY/?igshid=115q6anbtxz1g",2020-03-31 23:58:21+00:00,#traveltuesday #wander_explore_experience #travel #southcarolina #beach #vitaminsea,"Bingöl,Turkey"
798,"and also I believe in the strength of high Vitamin C but in some cases, they get Covid19 is so bad it cannot save everybody if they have other issues that compound the situation like asthma or Lupus or cancer even undiagnosed cancer",2020-03-31 23:58:06+00:00,,"Bingöl,Turkey"
799,"Dear Mr Inskeep, I wanted to reach out because a physician in Shanghai is using IV vitamin C with coronavirus and 50/50 patients lived. There will be a press release I will send to you shortly. In the meantime: http://www.orthomolecular.org/resources/omns/v16n18.shtml",2020-03-31 23:57:45+00:00,,"Bingöl,Turkey"
800,I have no arms or legs ,2020-03-31 23:57:43+00:00,,"Bingöl,Turkey"
801,It's crazy how bad i look right now ,2020-03-31 23:57:42+00:00,,"Bingöl,Turkey"
802,Saya menjual (COD) Vitamin... seharga Rp55.000. Dapatkan produk ini hanya di Shopee! https://shopee.co.id/oman_sutrisna/7517520545 #ShopeeID,2020-03-31 23:57:37+00:00,#ShopeeID,"Bingöl,Turkey"
803,2020年4月1日・・・ビタミンTee西国分寺秘密基地 自宅待機モード・・・ビタミンTeeオンラインアートショップ、そろそろ再稼働の準備に入ります。で、寒さにも負けないで花見をする鳥を発見！・・・(^_^;,2020-03-31 23:57:17+00:00,,"Bingöl,Turkey"
804,Calming Formula promotes sleep and relaxation. Enter to #WIN Sublingual #Vitamins from #SuperiorSource #WomensHealth #GMOFree#NoPills2Swallow #CVS4Health #sponsored https://bit.ly/2UeBDSM,2020-03-31 23:57:10+00:00,#WIN #Vitamins #SuperiorSource #WomensHealth #CVS4Health #sponsored,"Bingöl,Turkey"
805,"One thing I've noticed about Amazon - don't love them, but they've proven antifragile in this - they now advertise 'China Free' on products. I ordered vitamins based on that.",2020-03-31 23:57:10+00:00,,"Bingöl,Turkey"
806,Meet me at the Riverwalk ,2020-03-31 23:57:07+00:00,,"Bingöl,Turkey"
807,Soaking up some end of the day Vitamin D with these two! #stayhome #piebalddachshund #dogsofinstagram https://www.instagram.com/p/B-atGEFDSaw/?igshid=1hhhgl6p5heoe,2020-03-31 23:57:03+00:00,#stayhome #stayhome #piebalddachshund #dogsofinstagram,"Bingöl,Turkey"
808,PLAY & Let The Fun Begin Like + RT + Click https://www.reddeergames.com Did You see it? ,2020-07-28 20:47:23+00:00,,"Bingöl,Turkey"
809,I was always confused by the Ester-C commercials. Ester-C is billed as nonacidic. But isn't Vitamin C ascorbic acid?,2020-03-31 23:56:59+00:00,,"Bingöl,Turkey"
810,kurang dikasih vitamin c,2020-03-31 23:56:52+00:00,,"Bingöl,Turkey"
811,"Upon diagnosis #COVID19, Don’t wait for gross expression on an X-ray Immediately w/fever spike 100°F! Keep Vitamins #D3 5000iu per day C 1000mg 2x day Simultaneously start #Tamiflu 30mg 2x/day #Doxycycline 100mg 2x/Day Admited #Ceftriaxone 1g 2x/D or NONAdmitted Keflex 500mg 2/D",2020-03-31 23:56:39+00:00,#COVID19 #D3 #Tamiflu #Doxycycline #Ceftriaxone,"Bingöl,Turkey"
812,Deals2020: Kleenex Facial Special Care Tissues With Aloe Vera and Vitamin E $1.99 + Delivery ($0 with Prime/ $39 Spend) @Amazon AU ,2020-03-31 23:56:33+00:00,,"Bingöl,Turkey"
813,Weekly Vitamin C restock ,2020-03-31 23:56:25+00:00,,"Bingöl,Turkey"
814,I have yet to see an admitted COVID-19 patient with a vitamin D level above 33 . I’d love to hear if others have seen sick COVID patients with high vitamin D levels to refute my theory that normalish vitamin D levels (~50+) are inversely associated with disease severity.,2020-03-31 23:56:23+00:00,,"Bingöl,Turkey"
815,This is interesting as I was hospitized in mid Nov with severe breathing problems similar to the virus but I was already stage 4 COPD. Anyway they added Vit D to the rest of the meds & Vitamins I'm taking. I think it's helping. ,2020-03-31 23:56:22+00:00,,"Bingöl,Turkey"
816,"I took all my vitamins and I brought a soda so that means it is party time, yes?",2020-03-31 23:56:21+00:00,,"Bingöl,Turkey"
817,Minum vitamin dan cuci tangan #DGITM,2020-03-31 23:56:15+00:00,#DGITM,"Bingöl,Turkey"
818,"Someone called them the WDO, you can guess what the D means, not vitamin D.",2020-03-31 23:56:09+00:00,,"Bingöl,Turkey"
819,taking my@vitamin d tablets with rum and coke no one can stop me,2020-03-31 23:56:08+00:00,,"Bingöl,Turkey"
820,I need vitamin sea. . . . . . . #instagram #instagramers #instagood #instamood #instadaily #igers #igersph #igersphilippines #igersdaily #dailypic #dailyphoto #photooftheday #picoftheday #vsco #vscocam #vscoph… https://www.instagram.com/p/B-as9cDHXXA/?igshid=zae2cuxv7ay5,2020-03-31 23:55:51+00:00,#instagram #instagramers #instagood #instamood #instadaily #igers #igersph #igersphilippines #igersdaily #dailypic #dailyphoto #photooftheday #picoftheday #vsco #vscocam #vscoph,"Bingöl,Turkey"
821,"ORGANIC MASSAGE CANDLES Visit our online shop now to discover the full range of the cosmos organic massage candles by Laboratoire Altho Each candle contains Coconut Oil Shea Butter, Beeswax &amp;amp; Vitamin… https://www.instagram.com/p/B-as8Noqa4b/?igshid=m2nese6mske2",2020-03-31 23:55:44+00:00,,"Bingöl,Turkey"
822,Vitamin D deficiency,2020-03-31 23:55:33+00:00,,"Bingöl,Turkey"
823,"Upon diagnosis #COVID19, Don’t wait for gross expression on an X-ray Immediately w/fever spike 100°F! Keep Vitamins #D3 5000iu per day C 1000mg 2x day Simultaneously start #Tamiflu 30mg 2x/day #Doxycycline 100mg 2x/Day Admited #Ceftriaxone 1g 2x/D or NONAdmitted Keflex 500mg 2/D",2020-03-31 23:55:27+00:00,#COVID19 #D3 #Tamiflu #Doxycycline #Ceftriaxone,"Bingöl,Turkey"
824,Take your vitamins @Jessicasquared9,2020-03-31 23:55:16+00:00,,"Bingöl,Turkey"
825,"Remember to take care of your bodies and health during this season. Our bodies need all the nutrients, vitamins, rest, water; sometimes we get so busy, we don’t realize what we are putting our bodies through. Be safe.",2020-03-31 23:55:11+00:00,,"Bingöl,Turkey"
826, not me...I'm over 25...they need vitamins ,2020-03-31 23:55:08+00:00,,"Bingöl,Turkey"
827,"Man I been so productive. Editing, taking vitamins, feeling good. I’m in a good headspace right now regardless of what’s going on outside ",2020-03-31 23:54:54+00:00,,"Bingöl,Turkey"
828,"I feel like I leveled up as an adult, I took my vitamins 2 days in a row.",2020-03-31 23:54:49+00:00,,"Bingöl,Turkey"
830,そういう日も大切ですね,2020-03-31 23:54:48+00:00,,"Bingöl,Turkey"
831,"These Foods Will Help Reducing Anxiety There are foods that can help ease anxiety. Some of them are almonds, which have vitamin E and B12, zinc and magnesium, which increases the immune system. Others are sources of ... - ",2020-03-31 23:54:38+00:00,,"Bingöl,Turkey"
832,vitamin D has many benefits. are you getting enough? #vitamind #immunesupport #immunesystem #immunesystembooster #sunshine #sunshinevitamin https://www.instagram.com/p/B-aszSQjk72/?igshid=124lrw3wc385k,2020-03-31 23:54:30+00:00,#vitamind #immunesupport #immunesystem #immunesystembooster #sunshine #sunshinevitamin,"Bingöl,Turkey"
833,Check out my broadcast from my PlayStation 4! #PS4live (Call of Duty®: Modern Warfare®) live at,2020-03-31 23:54:26+00:00,#PS4live,"Bingöl,Turkey"
834,I’ve eaten nothing but oranges. Because ya know vitamins ,2020-03-31 23:54:00+00:00,,"Bingöl,Turkey"
835,Vitamin D works like a charm ,2020-03-31 23:53:58+00:00,,"Bingöl,Turkey"
836,YEAH I GOT IT FROM THE VITAMIN SHOPPE BUT GNC SHOULD HAVE IT! YOU GOTTA DRINK IT IMMEDIATELY AFTER A BIG MEAL!,2020-03-31 23:53:57+00:00,,"Bingöl,Turkey"
837,Oyyy kuzum. Lütfen biri sahip çıksın. Raşitizm bu çocuk. D3 Vitamini kullanması lazım.. Ayağı Sarılmalı. Ve vitamin desteğiyle düzelir. Ama mutlaka D3 Vitamini yapılmalı. Maalesef küçük yavrularda çok oluyor. Ama düzeliyor. Benim çok düzeldi.,2020-03-31 23:53:55+00:00,,"Bingöl,Turkey"
838,"Sippin' on this Hennessy, once you were my friend Now you turned into my enemy, here we go again I think love is just like money how it blows in the wind Got me taking medicine, these is not no vitamins",2020-03-31 23:53:36+00:00,,"Bingöl,Turkey"
839,아직 정해진건 없어서 모르겠어요 일단 후르트링하고 비요트준쮸 만들어보고 알려드릴게요..!,2020-03-31 23:53:26+00:00,,"Bingöl,Turkey"
840,Yo gurl was like haha you’re fine you don’t need to take your vitamins but that all changed when I stood up from takin a sit down on my walk and everything went BLURRY,2020-03-31 23:53:21+00:00,,"Bingöl,Turkey"
841,"Upon diagnosis #COVID19, Don’t wait for gross expression on an X-ray Immediately w/fever spike 100°F! Keep Vitamins D3 5000iu per day C 1000mg 2x day Simultaneously start #Tamiflu 30mg 2x/day #Doxycycline 100mg 2x/Day Admited #Ceftriaxone 1g 2x/D or NONAdmitted Keflex 500mg 2x/D",2020-03-31 23:53:21+00:00,#COVID19 #Tamiflu #Doxycycline #Ceftriaxone,"Bingöl,Turkey"
842,https://youtu.be/rDnIeTXEyyM here is a sample of how to properly use gimmicks exfoliating mask and skin care. A combination of Shea butter vitamin a vitamin a and O perfected blend of salt helps to provide the radiant skin that you need for the perfect at home facial. For more infor… ,2020-03-31 23:53:13+00:00,,"Bingöl,Turkey"
843,must take a 500mg of vitamin C too and a cup of ginger tea with a lemon extract. i helps a lot to avoid C19. also wash hand properly in time to time. - BeMyLady ,2020-03-31 23:53:03+00:00,,"Bingöl,Turkey"
844,Vitamin D boosts viral immunity.,2020-03-31 23:52:45+00:00,,"Bingöl,Turkey"
845,"Screwdrivers, actually. For the vitamin C. Gotta keep my immune system in good order. I feel stronger already.",2020-03-31 23:52:27+00:00,,"Bingöl,Turkey"
846,"Now the scam be say Na Vitamin C, They cure the coro... U see am See proof ooo https://m.scooper.news/detail?newsId=9143458&amp;utm_source=com.transsion.hilauncher",2020-03-31 23:52:08+00:00,,"Bingöl,Turkey"
847,Memang berjemur bisa meningkatkan asupan vitamin D. Tapi apakah ada risetnya orang dengan imunitas/daya tahan tubuh yang kuat tidak mudah &amp; tidak bisa tertular virus COVID-19 ? Kok tidak sekalian menghimbau masyarakatnya menahan nafas selama 1 jam agar tidak tertular COVID-19 ?,2020-03-31 23:52:01+00:00,,"Bingöl,Turkey"
848,My skin is so bad. Normally use Vitamin E range at Body Shop but doesn’t seem to help my skin with breakouts...recommendations?,2020-03-31 23:52:01+00:00,,"Bingöl,Turkey"
849,Been taking 3 vitamin c tabs a day to keep the cold away ,2020-03-31 23:51:54+00:00,,"Bingöl,Turkey"
851,"Hi. I'm on Day 14. I had all the symptoms you have. Take Mucinex if you have it. It will help you cough that stuff out. Steamy showers often, inhale steam. Sip warm water, it dissolves the mucus. Gargle warm salt water for sore throat. Vitamin C. Vicks vapor rub. Take care!",2020-03-31 23:51:54+00:00,,"Bingöl,Turkey"
852,Shocker ,2020-03-31 23:51:39+00:00,,"Bingöl,Turkey"
853,"Trying to place an order for my vitamins with #thevitaminshoppe Forty five minutes later, giving up. I don’t need this stress ",2020-03-31 23:51:38+00:00,#thevitaminshoppe,"Bingöl,Turkey"
854,"@ttocs35 It’s gotta be vitamin B12 Yeah, that’s the ticket. President Trump is the energizer POTUS45 &amp; MAGABOT is the Uniter of Patriots! Fld&amp;Rtd Much Thanks!",2020-03-31 23:51:21+00:00,,"Bingöl,Turkey"
855,Did you know? #scoliosis Vitamin D levels are lower in children with scoliosis! In Canada follow Heath Canada recommendation. Contact us for more information : scoliosisphysiotherapy@gmail.com https://youtu.be/VIeVOogRhx8,2020-03-31 23:51:19+00:00,#scoliosis,"Bingöl,Turkey"
856,"Shoutout to @Starbucks and @RubiosTweets for helping me get out of my apartment for cold brew and burritos, as well as a little vitamin D.",2020-03-31 23:51:17+00:00,,"Bingöl,Turkey"
857,Low key thought the second one was legit ,2020-03-31 23:50:53+00:00,,"Bingöl,Turkey"
858,이런게 있었네요,2020-03-31 23:50:53+00:00,,"Bingöl,Turkey"
859,Well stocked on Vitamin Y. ,2020-03-31 23:50:33+00:00,,"Bingöl,Turkey"
860,"work gave us ""gift bags"" with medium sanitizer bottles, tissues, emergenC, and vitamin c cough drops and like I understand it's like a ""keep employees healthy enough to work"" initiative but like. I appreciate the effort since a lot of other workplaces arent being nearly as kind",2020-03-31 23:50:12+00:00,,"Bingöl,Turkey"
861,i take a multi vitamin everyday barbara,2020-03-31 23:50:11+00:00,,"Bingöl,Turkey"
862,excited to see how this turns out. my brain just *refuses* to believe that vitamins are actually good for you...,2020-03-31 23:49:47+00:00,,"Bingöl,Turkey"
863,lmaooo he says thanks!,2020-03-31 23:49:34+00:00,,"Bingöl,Turkey"
864,Honestly I think it’s bc I’m not working but despite the circumstances I’m looking at it as a blessing in disguise rather than the end of the world. Try to stay positive and OD on the vitamin C and please be safe Jonica ,2020-03-31 23:49:25+00:00,,"Bingöl,Turkey"
865,Perhaps learning from eachother a much better idea than tweet arguments. The fact is your claims to support a link between nicotine vaping & lung illness is lacking. Just because it was false & unfairly blamed doesn't make it true. Science point's to THC: vitamin e &amp; pesticides.,2020-03-31 23:49:23+00:00,,"Bingöl,Turkey"
866,Well. If its possible since peppermint is good for lungs; get peppermint tea or candy cane. I am not a Dr. Or am I sick. Aspirin is my choice for aches pains fever headaches. Tylenol is an iffy to me. Hot bath for fever. And vitamin zinc . get well.,2020-03-31 23:49:21+00:00,,"Bingöl,Turkey"
867,"Upon diagnosis #COVID19, Don’t wait for gross expression on an X-ray Immediately w/fever spike 100°F! Keep Vitamins D3 5000iu per day C 1000mg 2x day Simultaneously start Tamiflu 30mg 2x/day Doxycycline 100mg 2x/Day Admited Ceftriaxone 1g 2x/D or NONAdmitted Keflex 500mg 2/D",2020-03-31 23:49:12+00:00,#COVID19,"Bingöl,Turkey"
868,"@DeborahBirx @JeromeAdamsMD @DrRichardCheng1 @VP What is the truth behind High Dosage Vitamin C used during Outbreak in Shanghai, China? Dr. Cheng, Medical Director of Shanghai Medical Center claims this treatment was highly effective, viz: https://youtu.be/NBbbncTR-3k",2020-03-31 23:48:47+00:00,,"Bingöl,Turkey"
869,"@biannagolodryga Speaking of Selenium heavy metal atomic #34, and building an immune system, is there good evidence showing Se can be helpful in correct dosage? Blueberries &amp; bananas appear to work well on cereal at breakfast. All vitamins B complex are urged.",2020-03-31 23:48:32+00:00,,"Bingöl,Turkey"
870,"Upon diagnosis #COVID19, Don’t wait for gross expression on an X-ray Immediately w/fever spike 100°F! Keep Vitamins #D3 5000iu per day C 1000mg 2x day Simultaneously start Tamiflu 30mg 2x/day Doxycycline 100mg 2x/Day Admited Ceftriaxone 1g 2x/D or NONAdmitted Keflex 500mg 2/D",2020-03-31 23:48:20+00:00,#COVID19 #D3,"Bingöl,Turkey"
872,"Untuk step pasien odp dan ditingkat diatsnya umum digunakan praktisi kesehatan dunia ,diawali dengn mengkover vitamin c dahulu....hidrokloro,digunakan tatkala sudah demam baru masuk ditahap penggunaan",2020-03-31 23:48:20+00:00,,"Bingöl,Turkey"
873,"UIN Syarif Hidayatullah sediakan makanan, buah, dan vitamin bagi mahasiswanya yang berasal dari luar kota dan saat ini masih tinggal di sekitar Ciputat, Tangsel. UIN Syahid Sediakan Makanan, Buah dan Vitamin bagi Mahasiswa Rantau Terdampak Covid-19 https://kemenag.go.id/berita/read/513102/uin-syahid-sediakan-makanan--buah-dan-vitamin-bagi-mahasiswa-rantau-terdampak-covid-19",2020-03-31 23:48:14+00:00,,"Bingöl,Turkey"
874,New York hospitals treating coronavirus patients with vitamin C ,2020-03-31 23:48:09+00:00,,"Bingöl,Turkey"
875,My quatantine so far: Makan cukup Asupan vitamin Tidur cukup ,2020-03-31 23:47:54+00:00,,"Bingöl,Turkey"
876,you'll get it when cis people are murdered for just being cis. until then shut up and eat sand,2020-03-31 23:47:53+00:00,,"Bingöl,Turkey"
877,♪。.:＊・゜ 見せつけるように 囁くように 私を照らすの あなたは私のVitamin とってもキラキラしてるの ♡Crystal/A Pink♡,2020-03-31 23:47:53+00:00,,"Bingöl,Turkey"
878,"15. Plug: If you feel sick get you some soup, vitamin C, so ginger hibiscus tea Leon: The hell is hibiscus? a cousin to the Bojangles biscuit? If so I fuckssss with it. Plug: Look call me 8am not 8:01 not 8:05. If you don't have jello and you call me ima kill you and larry.",2020-03-31 23:47:50+00:00,,"Bingöl,Turkey"
879,"Oh no! If shopping online is an option, you can find our products on our website (U.S.), Amazon, Thrive Market, Vitacost, and Lucky Vitamin. We hope this helps!",2020-03-31 23:47:41+00:00,,"Bingöl,Turkey"
880,Vitamin D and immunity https://youtu.be/W5yVGmfivAk via @YouTube,2020-03-31 23:47:34+00:00,,"Bingöl,Turkey"
881,"Pt 2 , because rn your skin is derived from vitamin D because foundation more than often contains SPF and plus it helps clear up acne scars and really shows a lot of improvement on your skin !!! Trust me !! Sun and water sis .",2020-03-31 23:47:21+00:00,,"Bingöl,Turkey"
882,Yea..the vitamin c is for cognac ,2020-03-31 23:47:21+00:00,,"Bingöl,Turkey"
883,"back to normal....semua nya jalanan rame transjakarta rame juga....ujung2 semua butuh makan dan hidup...jaga kesehatan minum vitamin, jaga jarak, jaga kebersihan...please be safe....",2020-03-31 23:47:20+00:00,,"Bingöl,Turkey"
884,COVID 19 (C) Cuci tangan/wudhu (O) Olahraga (V) Vitamin (I) Ikhtiar (D) Do’a (19) 2 Subuh + 4 Dzuhur + 4 Ashar + 3 Maghrib + 4 Isya + 2 Tahajud,2020-03-31 23:47:08+00:00,,"Bingöl,Turkey"
885,"And vitamins. The do something, right?",2020-03-31 23:47:08+00:00,,"Bingöl,Turkey"
886,"I'm at Vitamin Shoppe Cafe in Bitlis, TATVAN ",2019-03-09 18:26:38+00:00,,"Bitlis,Turkey"
887,Kardeş sen bü süreçte vitamin bile değildin helal olsun proteinler ağır basmış...,2019-12-29 16:01:29+00:00,,"Bolu,Turkey"
888,PLAY & Let The Fun Begin Like + RT + Click https://www.reddeergames.com Did You see it? ,2020-07-28 20:47:23+00:00,,"Bolu,Turkey"
889,"Formül 2 Vitamin ve Mineral Kompleks Kadınlar İçin ÜRÜN AÇIKLAMASI vücudunuzun ihtiyacını karşılamaya yardımcı olacak 24 besin öğesine giden kolay yolu keşfedin. Formül 2 Vitamin ve Mineral Kompleks Kadınlar İçin,… https://www.instagram.com/p/ByA7B5JBRB1/?igshid=91hmswwuhg10",2019-05-28 17:21:50+00:00,,"Bolu,Turkey"
890,Formül 2 Vitamin ve Mineral Kompleks Erkekler İçin ÜRÜN AÇIKLAMASI vücudunuzun ihtiyacını karşılamaya yardımcı olacak 24 besin öğesine giden kolay yolu keşfedin. Formül 2 Vitamin ve Mineral Kompleks Erkekler… https://www.instagram.com/p/Bx96n7KBgwc/?igshid=1x362ybuh3l5r,2019-05-27 13:20:35+00:00,,"Bolu,Turkey"
891,"I'm at Vitamin Kebap in Bolu, Türkiye https://www.swarmapp.com/c/hCXwpKQo8SE",2018-11-29 16:03:22+00:00,,"Bolu,Turkey"
892,"Kendinize bugün çeşitli meyvelerle, vitamin dolu 310 kalorilik bir Shake hazırlayın! Tüm malzemeleri karıştırıcıya (blender) ekleyin ve istediğiniz kıvama gelinceye kadar karıştırın.… https://www.instagram.com/p/BqCTCyclJK9/?utm_source=ig_twitter_share&amp;igshid=1fjs1jad2y4nw",2018-11-11 10:03:37+00:00,,"Bolu,Turkey"
893,"Kendinize bugün çeşitli meyvelerle, vitamin dolu 310 kalorilik bir Shake hazırlayın! Tüm malzemeleri karıştırıcıya (blender) ekleyin ve istediğiniz kıvama gelinceye kadar karıştırın.… https://www.instagram.com/p/BqB1B2mnVzm/?utm_source=ig_twitter_share&amp;igshid=u261se1rrqpc",2018-11-11 05:38:23+00:00,,"Bolu,Turkey"
894,"Fatma ile birlikte tavuk yemeceler (@Vitamin Kebap in Bolu, Türkiye) https://www.swarmapp.com/c/7cJKjNm6xXc",2018-07-21 14:39:31+00:00,,"Bolu,Turkey"
895,"I'm at Vitamin Kebap in Bolu, Türkiye https://www.swarmapp.com/c/bhCK5tQM4Cm",2018-02-19 09:37:00+00:00,,"Bolu,Turkey"
896,"I'm at Vitamin Kebap in Bolu, Türkiye https://www.swarmapp.com/c/4Wd7xyF96al",2018-02-10 13:05:18+00:00,,"Bolu,Turkey"
897,"I'm at Vitamin Kebap in Bolu, Türkiye https://www.swarmapp.com/c/eOu0a03Db18",2018-01-20 19:52:33+00:00,,"Bolu,Turkey"
898,"I'm at Vitamin Kebap in Bolu, Türkiye https://www.swarmapp.com/c/awFCqsztt2Q",2018-01-06 09:59:21+00:00,,"Bolu,Turkey"
899,"I'm at Vitamin Kebap in Bolu, Türkiye w/ @rmeysaozacar https://www.swarmapp.com/c/kUgo7pMahjP",2017-12-28 12:31:13+00:00,,"Bolu,Turkey"
900,"I'm at Vitamin Kebap in Bolu, Türkiye w/ @keremdemirel11 https://www.swarmapp.com/c/9AwqNsL4u5p",2017-12-13 18:50:11+00:00,,"Bolu,Turkey"
901,"I'm at Vitamin Kebap in Bolu, Türkiye w/ @keremdemirel11 @mbulut7 https://www.swarmapp.com/c/jsWmjkTHxQR",2017-11-30 18:31:18+00:00,,"Bolu,Turkey"
902,"I'm at Vitamin Kebap in Bolu, Türkiye https://www.swarmapp.com/c/cQPrpKvBUNr",2017-11-26 19:06:55+00:00,,"Bolu,Turkey"
903,"I'm at Vitamin Kebap in Bolu, Türkiye ",2017-09-04 14:30:57+00:00,,"Bolu,Turkey"
904,"I'm at Vitamin Kebap in Bolu, Türkiye https://www.swarmapp.com/c/0swWpvAqoyK",2017-08-30 21:05:41+00:00,,"Bolu,Turkey"
905,"I'm at Vitamin Kebap in Bolu, Türkiye https://www.swarmapp.com/c/0HzEwOfDo0R",2017-08-27 16:32:09+00:00,,"Bolu,Turkey"
