,Text,Date,Hashtags
2103,Anti depresan intihar ettirir mi bilmem ama ülkemde toplum her derdini anti depresan kullanarak çözmeye çalışıyor. Ekonomik sıkıntı nedeniyle sitresin bile çözümünü anti depresan içerek çözeceğini zanneden bireylere ilaç yazmakta sorun görmeyen hekimlere sahibiz.,2018-10-31 23:38:29+00:00,
2104,"Kapitalizmin en vahşi alanını tıp olarak görüyorum.Zehirler ve panzehirler tek elden çıkıyor.Hasta,çaresiz insanlar şifa adına milyarlarca dolarlık ilaç sanayinin kölesi oluyor.",2018-10-31 23:35:05+00:00,
2105,4 yıl antidepresan ilaç ile hayata tutunanlardanım..,2018-10-31 23:31:15+00:00,
2106,"1.İlaç endüstrisi-doktor ilişkileri doktorların hepsini etik çemberin dışına atmaz 2.Her bilimsel çalışma-yayın ilaç endüstrisi destekli değildir 3.Canan Karatay iddialarını bilimsel olarak ispatlamak zorunda,çalışmaları ilaç endüstrisi fonluyor diyerek kaçamaz",2018-10-31 23:26:23+00:00,
2107,"saatlerdir karanlıkta boş boş oturuyorum, hem miyop olup hem de sinüzit olunca tek ilaç karanlık oluyo maalesef..ne bi şey izleyebiliyorum ne de bi şey okuyabiliyorum ağlicam ağrıdan",2018-10-31 23:08:49+00:00,
2108,Benim öyle bir iddiam olmadi ama ilgi duydugum icin belki bir tip ögrencisinden cok bu konularda özellikle konferans ve yazilari makaleleri okuyan biriyim.. iddia da etmedim.Her Doktora da özellikle ilac konusunda güvenmiyorum!Ilacta da mafya olusmamis mi sizce??,2018-10-31 23:06:50+00:00,
2109,Zaman ilaç değil zehir,2018-10-31 23:05:08+00:00,
2110,Sıkıntı şurada ki bilimsel araştırmanın da size anlatılan kadarını biliyoruz. O da ilaç firmalarının tekelinde. Kimse malını kötülemez sonuçta bu ticari bir ürün alıcısı da hasta ve hastalık. Basit mantıkla ilaç şirketi tüm dünyanın sağlıklı olmasını istemez.,2018-10-31 23:02:33+00:00,
2111,"@rcanturk3 gözlere bulut çöktüyse,anlarız dosta dert uğramış.. önce dag gibi durup derdini yuklenir, sonra yaklastırır omuzunu, ""Sen güçlü birisin,Ağla"" Sıkıntının gergefinde sıkısıp kaldığım bir vakit ilac gibiydi bu cumleler ...",2018-10-31 23:01:35+00:00,
2112,Zaman ilaç derler ya .. Ellerin neden uzak hala ?? Hande Mehan - Sen Beni Güzel Hatırla (Official Audio) https://youtu.be/hmcUQVf_b-M @YouTube aracılığıyla,2018-10-31 22:59:43+00:00,
2113,"#DikkatimiÇekti bu hava degisiminden etkilenmeyen yani grip olmayan insanlar, hastalaninca ilac kullanmayanlar ",2018-10-31 22:55:29+00:00,#Dikkatimi
2114,"1960’larda da doktorlar kameralara poz verirlermis ”sigara icin, sagliga faydalidir” diye. Bir donem de ekranlarda kalp damar hastaligindan korunmak icin bol bol margarin yiyin derlerdi. Tamam ilac tuketmek vucuda cok zararli ama be kadin psikiyatriye de mi el attin ",2018-10-31 22:52:33+00:00,
2115,"her noktada hasta ilaçsız tedavi edilemiyor, psikoterapi alabilecek düzeye gelmek için bile ilaç kullanmamız gerekebiliyor. kaldı ki birçok psikiyatrik hastalıkta görülen hezeyan, disosiasyon gibi durumlar var;ilaçlar bulunmadan önceki dönemde bu hastalar çok zorluklar çektiler.",2018-10-31 22:51:06+00:00,
2116,Bismillah AllahuEkber! EsselamuAleyküm #TeheccüdHacetSeherVakti #GeceyeBirSözKoy Ey duam! Kalbimin kırılan yanlarına iyi gеlеn tеk ilaç sеnsin. Elhamdülillah! İnşa'Allah #SaferAyı #HayırlıGeceler #KalbimizİdlibFilistinde #İstanbulHavalimanı ,2018-10-31 22:49:18+00:00,#Tehecc #GeceyeBirS #SaferAy #Hay #Kalbimiz
2117,"Konuşmadığı bir psikiatri alanı kalmıştı...onuda tamamladı sayın Karatay...Bir kadın ağır travma yaşamışsa (tecavüz ölümle burun buruna şiddet vs)bunun terapisi sokağa çıkıp hava almak mı? yoksa ilaç alıp tedavi olurken hava almak mı,kan sulandırıcı Aspirin bile yan etkili hocam",2018-10-31 22:49:06+00:00,
2118,Abilify psikiyatrik ilaç dürtü bozukluğu yapar cinsel sapmalara yol açar.,2018-10-31 22:45:48+00:00,
2119,Zaman hızla sadece sessizliği ile konuşur insanoğlu ise sadece zamanın ilaç olmasını bekler●● ,2018-10-31 22:40:20+00:00,
2120,O Hanımefendi halkı gerçek bilgilerle bilgilendiriyor hepsi bilimsel siz ise halkı ilaç firmalarının doğrultusunda aldatıyorsunuz. Şarlatan kim acaba?,2018-10-31 22:38:06+00:00,
2121,Hangisin de para ülke dışına cıkmıyor ki Devlet işini yapar işletme kaydı açar vergi ye tabii olur Bim Market ler den tut banka lar kredi kartları ilaç tan silah a kadar alayı dış ülke lerin,2018-10-31 22:36:26+00:00,
2122,"O kadar etik,o kadar donanımlı ve tırnaklarıyla prof. ünvanı almış saygın doktorlar tanıyorum ki o yüzden bu yazdığının bir anlamı yok.İlaç da kullanma sen,ne de olsa ilaç lobisi.Kaza geçirip acillere düşsen anestezisiz ameliyat etsinler seni,ne de olsa o da bir ilaç ",2018-10-31 22:33:22+00:00,
2123,İnsan harcamak ne kadar kolay Kimbilir ne ne uykusuz geceleri geçti o ünvanı almak için. Canan Karatay gibi düşünmeyen herkese ilaç firmalarının oyuncağı muamelesi yaparken vicdanınız sızlamıyor mu?,2018-10-31 22:24:57+00:00,
2124,Kimin yarasına ilaç olursan ol iyileştiginde yara kabuğu düşer,2018-10-31 22:19:28+00:00,
2125,Yalnızlığa ilaç çıksa.,2018-10-31 22:16:13+00:00,
2126,bu hastalığımdan ben bezdim o benden bezmiyor bırak beni obsesif bırak vallaha ilaç içmekten ömrüm çürüdü kontrol edememekten de beynim,2018-10-31 22:15:23+00:00,
2127,"e ne bekliyorsunuz ki? İlaç firmaları doktorların %99u ile temas halinde,ilaçlarını tanıtıyorlar,eşantiyon veriyorlar,para veriyorlar,hatta kâr payı alıyorlar. Doktor da ilacı doğal olarak hastasına ""gerekmese bile"" yazıyor,Sonra vatandaş da ilaç deposu olup çıkıyor. Düzen böyle.",2018-10-31 22:13:29+00:00,
2128,Dalyarak kadın ne diyor sen ne anliyon. Antidepresan alanların bir çoğu intihari düşünmüyor mu? Psikiyatrist olarak ilaç dayayacaz diye milleti galeyana getirme.,2018-10-31 22:12:55+00:00,
2129,Sizin gibi doktorların hastalarını antidepresan ilaçlarındışında verdiği ilaç ve çözüm YÖK çoğu hastalarını bu yöntemle sadece uyuşturuyorsunuz,2018-10-31 22:10:38+00:00,
2130,Kendini bilmezlere ilaç olur mu dersin aynalar ?,2018-10-31 22:08:15+00:00,
2131,o zaman bir ilaç bul da hepimize çare bul Ayşenur Şaka bir yana da kendi antibiyotiğimi ürettim ben ilaç tesir ediyor valla ,2018-10-31 22:07:18+00:00,
2132,Psikiyatrik ilaçların yan etkisi intihar olan bir ilaç nasıl size fayda sağlasın.,2018-10-31 22:05:47+00:00,
2133,"Bayılıyoruz komplo teorilerine.Heee evet her şeyin arkasında ilaç lobisi var.Almayın içmeyin o zaman.Hatta ameliyata girdiğinizde uygulanan anestezide de ilaç kullanılıyor.Reddedin anesteziyi o zaman,cerrahlar kafadan kessin Aşırı komplo teoricilik midemi bulandırıyor",2018-10-31 22:04:38+00:00,
2134,Türkiye'de de her grip olana antibyotik her deprasyonda olana Antidepresan dayiyor doktorlar!!Bu kadar ilac seven ülke görmedim doktorlariyla hastalariyla.. ILactan ölenlerin miktari ne kadar acaba Türkiye'de bir de yanlis kullanim var tabii ki tartisacak!,2018-10-31 21:56:53+00:00,
2135,Ya dua kapılarim açıksa ve bu hakkımı senin burun akıntın için harcarsam bunu göze alamam sami ilaç kullan ,2018-10-31 21:54:24+00:00,
2136,Onu bilmem de bi ilaç kullansan iyi edersin,2018-10-31 21:53:51+00:00,
2137,ABD Silah ticaretinden sonra biliyorsunuz ki ilac ticareti ile insanlari öldürmekte!Ben de yurt disinda yasiyorum ve basta doktorum olmak üzere bircok doktor Canan Karatay gibi tezleri savunuyor!!Seker ve özellikle Kolestrol ve Antidepresanlar yan etkileri yarardan cok zarar !!,2018-10-31 21:53:03+00:00,
2138,Benim arkadaşım ilaç şirketinde çalışıyor doktorlara hastaya ilaç yazmaları için verdiği yüklü rüşvetleri gözlerimle gördüm,2018-10-31 21:52:21+00:00,
2139,Bildiğim kadarıyla o hekim kolesterolün zararı hakkında konuştu.Kat kat fazla sayıda prof.kardiyologtan oluşan Türk Kardiyoloji Derneği “Kolesterol ilaçları kullanılmamalı yönündeki açıklamalar halk sağlığını tehdit ediyor”.Hepsi mi ilaç lobisinin adamı?,2018-10-31 21:51:29+00:00,
2140,"Eczacılar, eczacılarımız.. Kimseden çekmedim ilacı sildim diyip silmeyen eczacıdan çektiğim kadar.. Bi ecz amcaya 'Beyefendi napabilirim okusaydınız siz dr olsaydınız siz ilaç yazsaydınız' dedim de bana 'Kızım Allah anana babana OLDUĞUNU SANMAM AMA KOCANA SABIR VERSİN' demşti ",2018-10-31 21:50:55+00:00,
2141,"peki bu işlem bir ilaç mı, neye iyi geliyor hocam",2018-10-31 21:50:37+00:00,
2142,Yaşamın samimiyetsizliği ve durgunluğuna en güzel ilaç sohbeti yaygın hale getirmektir.,2018-10-31 21:49:38+00:00,
2143,Sana ilaç gibi gelen insanın aslında eczane çıkması.,2018-10-31 21:48:19+00:00,
2144,yurtdışı seminerler....Yurtiçi seminerler..çağrılmanın dayanılmaz hafifliği...eee bunlar bi yerden çıkacak... Kongre daveti...borumu...amerika sırada....hatır.ve kota....sektör ilaç olunca....hasta napsın...biri yazacak biri kulanacak......!!!,2018-10-31 21:47:06+00:00,
2145,Sanki bilerek uyumuyoruz aq. gelmiyor işte ne yapalım ilaç mı atalım,2018-10-31 21:45:35+00:00,
2146,2.doktorlar hastayı görmeden sadece koridorda ki dosyalara bakarak hastalara uygulanacak ilaç vs belirliyorlar. Gayri ihtiyari abimin dosyasını karıştırırken kesinlikle şeker hastası olmayan abime insilün uygulandığını farkettim.. -,2018-10-31 21:45:21+00:00,
2147,"Nje nder produktet me te suksesshme UTHULLA E MOLLËS SË EGËR SI ILAÇ BOMBË PËR TENSION TË LARTË,SHEQER TË LARTË, YNDYRË TË LARTË NË GJAK Uthulla e mollës se eger është shumë e… https://www.instagram.com/p/BpnOchchpjE/?utm_source=ig_twitter_share&amp;igshid=vfhndylmmnp4",2018-10-31 21:40:10+00:00,
2148,"Nje nder produktet me te suksesshme UTHULLA E MOLLËS SË EGËR SI ILAÇ BOMBË PËR TENSION TË LARTË,SHEQER TË LARTË, YNDYRË TË LARTË NË GJAK Uthulla e mollës se eger është shumë e… https://www.instagram.com/p/BpnOXPzhQeT/?utm_source=ig_twitter_share&amp;igshid=1wfigb64zgdhk",2018-10-31 21:39:37+00:00,
2149,Allah hastalara şifa dertlilere deva evi olmayana ev işi olmayana iş bekara eş aç olana aş ilaç bekleyene ilaç versin amin #dualarınızıbekliyoruz,2018-10-31 21:38:21+00:00,#dualar
2150,"Nje nder produktet me te suksesshme UTHULLA E MOLLËS SË EGËR SI ILAÇ BOMBË PËR TENSION TË LARTË,SHEQER TË LARTË, YNDYRË TË LARTË NË GJAK Uthulla e mollës se eger është shumë e… https://www.instagram.com/p/BpnN7oshofg/?utm_source=ig_twitter_share&amp;igshid=ifzbgm0b9s4u",2018-10-31 21:35:42+00:00,
2151,"Çaycı getir ilaç kokulu çaydan, Dakika düşelim senelik paydan... -Necip Fazıl Kısakürek",2018-10-31 21:35:10+00:00,
2152,"Furkan ilaç niyetine şeyapıyor kardeşim,hastalıkları önlüyormuş ",2018-10-31 21:33:14+00:00,
2153,Ruh ve zihin karmaşasının bir kapsül ilaç ile çözülebildiği günleri görelim artık. Görelim ki bu kadar içim sıkılmadan şu gözlerimi en azından bir ay huzurla kapatayım yarabbim.,2018-10-31 21:32:38+00:00,
2154,"Abi sizin ilaç Udoh. Bak net diyorum. Utah Kcp'ye karşı verir. Şutör lazım falan. McGee falan olacak iş değil. Çok toparlar takımı, kısa kalıyor falan da yeni düzende poat up falan kalmadı. Podcast çok iyi bu arada.",2018-10-31 21:32:35+00:00,
2155,bugunu ilac icmeden tamamlamaya calıstım ama tamamlayamadım,2018-10-31 21:31:10+00:00,
2156,"Sana o profesörlük ünvanını kasaptan mı aldın Antidepresanların prospektüsünün hemen hepsinde bu bilgi var zaten.. Accık beyin lütfen, prof olmuş ama kendini ilaç firmalarına satmış şey",2018-10-31 21:30:37+00:00,
2157,#DikkatimiÇekti de sokakta en kötü araba 60-70 bin lüks evler siteler plazalar avmler fastfood zincirleri adımbaşı süpermarket zinciri hep şikayet hep yok? Biraz şükür edin yaa Afrika'da insanlar içme suyu ilaç gıda bulamıyor. Utanıyorum!,2018-10-31 21:29:54+00:00,#Dikkatimi
2158,Az önce filmden geldim. Timuçin esen Oscarlık bir oyunculuk sergilemiş. Film duygusal insanlar için ilaç.,2018-10-31 21:28:09+00:00,
2159,"Eğer iki kişiden biri yalan söylüyorsa bu Canan Hoca değildir, Eğer iki kişiden biri şarlatansa bu da Canan Hoca değil, yıllarca yazdıkları antideprasanların çöp olduğunun ortaya çıkmasından ve ilaç firmalarından gelen vananın kapanmasından korkan paranın kölesi zavallılardır.",2018-10-31 21:25:18+00:00,
2160,Royal ilaç firması için hazırladığımız yeni reklam filmi... Emeği geçen herkese teşekkür ederim... https://www.facebook.com/100001258830116/posts/2061790370539571/,2018-10-31 21:23:47+00:00,
2161,Çok doğru efendim . Keşke rafineri olmasaydı Rafineri tüm yağlar - tuz ve şeker ve işlenmiş gıdalar özellikle tüketilmesinin nedeni daha fazla ilaç .... olabilir mi?,2018-10-31 21:23:01+00:00,
2162,"Îşın içinde para var, herkes canan Karatay'a çamur atıyor.çünkü insanların derdine derman olmak için araştırma yapmak ZOR milleti soymak ückagitcilik hem KOLAY hem kazançlı asil vicdansız ve $arlatanlar milleti böcek gibi gorup adına ilaç dedikleri ZEHIRLERI reçeteye yazanlardir.",2018-10-31 21:22:22+00:00,
2163,"Bakın burası çok önemli; Bu CHP ''Böyle bir şey olabilir mi? Böyle bir şey olabilir mi? Böyle bir şey olabilir mi? '' diye bize sormayı bırakmadıkça, sağlık sektörü de, ilaç sektörü de özelleşir, satılır. Biz bile özelleştirilir, satılırız...",2018-10-31 21:21:32+00:00,
2164,"Canan hanım gayet haklı, insanları bile bile antidepressant çukurlarına sürükleyenler şarlatan, ilaç firmalarıyla anlaşıp halkın sağlığıyla oynayanlar şarlatan. ",2018-10-31 21:19:50+00:00,
2165,Zaman ilaç değil bu arada insan unutkan,2018-10-31 21:19:43+00:00,
2166,Rusya gidecek olan sebze meyve kimyasal ilaç konusuda hassas şekilde denetlenecek.İç piyasada ise çaldım çayıra.,2018-10-31 21:18:40+00:00,
2167,"Araya zaman girince iyileşeceğine inanılan şeyler gittikçe soğuyor, kopuyor. Zaman ilaç değil yaradır bazen... ",2018-10-31 21:18:10+00:00,
2168,Hocam tanıma kriteri belirtier olamaz Tedavi için etmenler gerek. Oda Güncel tetkikler ile olur. Sizin özelinizde hormonların az veya çok üretme nedeni bulmadan ömür boyu ilaç kullanmak zorunda kalırsınız İyileşmeniz şanstır Yada daha ağır ilaç almak zorunda kalırsınız,2018-10-31 21:17:29+00:00,
2169,Bu konu çok su götürür dünya ilaç sektöründe trilyon dolarlar dönüyor haplar şifa vesilesi mi zarar mı bilinmez.İnsanlar da güvensizlik var hap müptelası oldu millet ,2018-10-31 21:17:17+00:00,
2170,"Arkadaşım hasta olmuş geldi 4 saat yanımda oturdu, ben ilaç mıyım acaba",2018-10-31 21:14:53+00:00,
2171,"İnsanın yanında; ilaç gibi insanlar olmalı, ağrılarını dindiren, yan etkisi olmayan.",2018-10-31 21:14:37+00:00,
2172,Arkadaşlarım hasta olunca ben: Iyi misin boğazın ağrıyor mu ateş var mı bak iyice dinlen ilaç ne kullandın doktora gittin mi ah kıyamam sana. Ben hasta olunca arkadaşlarım: Sızlanma Gökçe ya ağlama Gökçe abartma Gökç,2018-10-31 21:13:36+00:00,
2173,"Madem anti depresanlar bu kadar masum, O halde siz için.. Canan Karatay hoca milli ve yerlidir, ilaç firmalarının değil, bu milletin yanındadır..",2018-10-31 21:11:00+00:00,
2174,"Patlat, ben bu yüzden gidemem gitmem... şarkını hiçbir şeyin kalmaz. İlâç'tır ilâç..",2018-10-31 21:11:00+00:00,
2175,Orayı bilmem de Erzincanda kamuflajların poşetini kendimiz açtık. Sıfır kullanılmamış. Ayrıca terhis zamanı don sadece kamuflajı alıyorlar kuru sıkmış vatandaş.Gözünüzde büyütmeyin sadece hasta olacaksınız tedbirli olun ilaç sokmaya çalışın ihtiyacınız olacak..,2018-10-31 21:07:42+00:00,
2176,Antidepresanlar insanları depresyon bağımlısı yapıyor. (kesin bilgi) Tüm psikiyatrlar ilaç firmalarının kiralık katilleridir. (kesin bilgi),2018-10-31 21:07:09+00:00,
2177,Canan Karatay sizi ilaç bağımlısı yapmadığı için sevmezsiniz tabii!,2018-10-31 21:04:59+00:00,
2178,Mehmet Güreli-Feelings https://youtu.be/5SprcKoxpZA via @YouTube ilaç gibisin ,2018-10-31 21:03:46+00:00,
2179,Ulan Erzincan mikroplarını hala atamadım üzerimden.. Poşetle ilaç içiyorum boğazım yırtıldı öksürmekten.,2018-10-31 21:01:55+00:00,
2180,"Dikkatin en büyük deposu dopamin ve Allah vergisi biçimde beynim doğru düzgün dopamin salgılamıyor hocam. Spor, seks, kahve, sosyal yaşam, akademik başarı... Bunlar dopamin seviyemde ortalama 1 birim ileri oynama yapıyorsa, ilaç 10 birim yapıyor.",2018-10-31 21:00:15+00:00,
2181,Zaman ilaç değil yaradır bazen,2018-10-31 20:59:15+00:00,
2182,"Terapistim Kaplana’a gidiyorum, ilaç gibi geliyor ",2018-10-31 20:57:54+00:00,
2183,"Annem: ilaç, bitki çayı, meyve suyu, çorba ve tadı kokusu kötü olan envaiçeşit bi şeyler Ben: g.o favı alalımmmm Allah kahretsin böyle siteyi....",2018-10-31 20:56:22+00:00,
2184,"dürüst şekilde kontrol gruplu etki analizi, araştırması yapıp, göster, tekrarlanabilir şekilde uygula, minare gölgesi ile de tedavi yapabilirsin. Ama tv den ayetli hadisli, tüm hastalarım şifa buldu diye anektod sallayarak ilaç öneren sahtekar, çoğu durumda katildir..",2018-10-31 20:55:04+00:00,
2185,Canan Karatay bilimsel olarak verilen cevapları kabul etmedi.Kendisine karşı çıkan herkesi ve milyonlarca klinik çalışmayı arkasında ilaç lobileri var diyerek reddediyor.İlaç firmalarından bağımsız çalışmaları da yok sayıyor ve popüleriteye oynuyor.Dolayısıyla sabır bitti,2018-10-31 20:54:35+00:00,
2186,"Lokman Hekim derki: Uzun yıllar boyunca değişik ilaçlarla insanları tedavi ettim. Bu uzun süre zarfında şu sonuca vardım: ""Sevgi ve muhabbetten daha etkili ve tesirli ilaç yoktur"" ",2018-10-31 20:54:18+00:00,
2187,Zaman herşeye ilaç da zaman senin yaranı kapatacak ilacı henüz satışa çıkarmamış be iki gözüm,2018-10-31 20:51:25+00:00,
2188,Odaya giren hasta selam vermeden doktor ilaç yazmaya başlıyor. Üç dk içinde meramının dörtte birini anlatamadan eline bir torba ilaç tutuşturup gönderiyorlar.,2018-10-31 20:51:01+00:00,
2189,Prof olmussunuz ama bu kadar dogru bir bilgiyle Turk halkini uyarmaya calisan baska bir prof.a sarlatan diyorsunuz.Oysaki antidepresanlarin cogu ilac sektörünün insanliga dayatmasi.Bunu da sizin elinizle yapiyorlar.Sizden cok korktum.Sizi takibi kesiyorum.,2018-10-31 20:50:42+00:00,
2190,Bazi Dr. hatalarini ilaclara yuklememek lazim. Dogru tespit ve ilac tedavisi hayat kurtarir. Yoksa cinnet yuzunden cok insanin cani yanar.,2018-10-31 20:50:19+00:00,
2191,"CNN Türk'te Canan Karatay, İlaç endüstrisi ve şeker oligarşisinin tekerine çomak sokuyor. Tebrik ediyorum Canan Hocayı Tıp, İnsan anatomisinden daha çok insanın ilaç endüstrisi ile ilişkisiyle ilgileniyor ",2018-10-31 20:49:41+00:00,
2192,Kesinlikle doğru ilaç firmalarına çalışıyorlar,2018-10-31 20:49:38+00:00,
2193,Mevsim geçişlerinden midir nedir cildim bu ara çok kuru. Ve @denebunucom 'un gönderdiği @neutrogenaturkiye 'nin Hydro Boost yoğun nemlendirici hidrojel maskesi ilaç gibi geldi 20 dk yüzümde kaldı. Maskenin... https://www.facebook.com/298328656947305/posts/1904628989650589/,2018-10-31 20:49:14+00:00,
2194,"İlaçla Zehir arasındaki fark dozdur, Dozu fazla kaçırırsanız ilaç zehre dönüşür. Insanlarin Sevgisi de tam olarak böyledir. Derman olmak isterken Yanlış dozla zehir olurlar.",2018-10-31 20:47:58+00:00,
2195,"#cananhocahakli evet tek basina ilac firmalarina karsi mucadele ediyor, helal olsun..",2018-10-31 20:42:54+00:00,#cananhocahakli
2196,"Bitkilerle tedaviyi kocakarı işi, hurafe diye etiketleyen modern tıbbın ilaç endüstrisi isviçre Alplerinde kuruludur. Çünkü ilacın hammaddesi olan bitki oradadır. Bitkiyi sen kullanırsan hurafe, o satarsa ilim olur.",2018-10-31 20:40:24+00:00,
2197,"#canankaratay dediklerine bakin hangisi yanlis, ilac firmalarinin oyununa gelmeyin,onlarin oynadiklari bizim hayatimiz...",2018-10-31 20:40:18+00:00,#canankaratay
2198,Öff yarın yine ilaç kullanan birsürü hasta polikliniğe hücum edecek panikle:( ,2018-10-31 20:39:51+00:00,
2199,Dün geceki 1 saatlik yayından sonra bu geceki 2 saatlik yayın ilaç gibi gelecek #SonSayfa @asporcomtr,2018-10-31 20:39:15+00:00,#SonSayfa
2200,わーいありがと ,2018-11-30 23:58:33+00:00,
2201,gemiyle rusyaya giris yapildiginda bu ilac narkotice giriyor kilit altinda,2018-11-30 23:48:03+00:00,
2202,"Türk Kızılayı Gazze’ye 8,5 ton ilaç yardımı yapacak https://buff.ly/2RpOcGX",2018-11-30 23:15:08+00:00,
2203,En iyi ilaç ellerindi ,2018-11-30 23:13:26+00:00,
2204,Düşünceleriyle başbaşa kalanlara ilaç olmaktı gayem...,2018-11-30 23:09:54+00:00,
2205,Her derde deva ilaç gibi shipim Maşallah diyim de nazar değmesin #NorEx ,2018-11-30 23:09:19+00:00,#NorEx
2206,Hayat bir içki ve aşk bir ilaç,2018-11-30 23:08:00+00:00,
2207,"hergün ayrı bir âlemde ellerinde puro marihuana, platinli burunlarına kokain, ex, vs eroin içmez onlar, kucağında birbirinden güzel hatunlarla eziyor bizim sigara ilaç paralarnı!! ki kendileri içmiyor sigarayı torbacı hesabı satar ama içmez!! bizde otu bile tütünle içiyorlar!!",2018-11-30 23:05:17+00:00,
2208,Ahahahaa lakaplarımızdan düşündüm ilaç gibi bi ad NorEx ,2018-11-30 23:05:00+00:00,
2209,Hayırlı olsun. Erzuruma Canan Hanım İYİ liderliğinde ilaç gibi gelip devrim yapacak. ERZURUMUN BEKLEDİĞİ BAŞKAN CANAN HANIM GELİYOR. GÜNEŞ YENİDEN DOĞACAK . DADAŞ GELİYOR.,2018-11-30 23:01:52+00:00,
2210,"Şifreli CİNE5'i decodersiz izleyen bir tabur asker biliyorum. Ebru Şallı ilaç gibi gelir. Hele de pilates nefesleri başladı mı, tüm bölük hamamcı olur artık. ",2018-11-30 22:56:43+00:00,
2211,adamlar da sadece silah yok öldürmek için hem de yola yola zenginleşe zenginleşe öldürüyorlar benim gibi salakları..hem de öyle böyle değil deli zenginleşiyorlar..bunlardan aldığımız zehirden hasta oluyoruz bi de bunların ilaç şirketlerine çalışıyoruz ölene kadar!! bunlarda,2018-11-30 22:54:50+00:00,
2212,"VanGogh 'işe yarayan' ilaç (örn. modern antipsikotikler) kullansaydı olarak düzelttiğinde anlam değişmiyor. 'yüksük otu sarı'ya hassasiyet yaratıyor kısmı tezin karşısında değil, irrelevant. ",2018-11-30 22:47:47+00:00,
2213,"@SAE_EC es signatario de los acuerdos MLA de IAAC e IAF y del acuerdo MRA de ILAC, para los campos de #Acreditación de organismos de #Certificación de sistemas y productos, organismos de #Inspección y #Laboratorios de ensayo y calibración. #AcreditaciónEsConfianza",2018-11-30 22:45:19+00:00,#Acreditaci #Certificaci #Inspecci #Laboratorios #Acreditaci
2214,⁦@RTEToday⁩ Stylist ⁦@ireneobrien⁩ chose these fab looks from Ilac stores to take you from work to that Xmas party. See them here. ⁦@DebenhamsIRE⁩ ⁦@hm⁩ ⁦@quizclothing⁩ ⁦@TKMaxx_IE⁩ ⁦@ClothingCatch⁩ #Rocket,2018-11-30 22:38:27+00:00,#Rocket
2215,"Süper çok zorlandığın zaman bir tane al, dil altı ilaç. Çok iyi. Süper bir uyku ve en iyisi sabah hiç birşey yokmuş gibi kalk ve işe. Hem enerji hem sakinleştirici. Araştır bak ama kesin tavsiye ederim",2018-11-30 22:35:45+00:00,
2216,Zestat diye bir ilaç varr biliyormusun,2018-11-30 22:31:29+00:00,
2217,Gülmek için ilaç varmi eyt ,2018-11-30 22:27:22+00:00,
2218,Abi ilaç kullanıyor musun hdhdhd,2018-11-30 22:26:16+00:00,
2219,"Allah'ın izniyle. Teşekkür ederim kardaşım. Belki sen gelmeden ben bi kaç günlüğüne gelebilirim , bi ilaç ile ilgili dayı beyden onay bekliyorum olur derse almak için geleceğim bakalım.",2018-11-30 22:25:19+00:00,
2220,Çağımızın en büyük vebası Manevi hastalıklardır... ve bilim bunu asla çözemeyecek! Ruhsal bozukluk yada psikolojik rahatsızlık tanısı koyup hastayı ilaç bağımlısı haline getirip ömrünün sonuna dek acı çektirmeye... https://www.facebook.com/550613797/posts/10156724358803798/,2018-11-30 22:23:05+00:00,
2221,Bedeninin dünyaya bağlılığı okadar fazlaki ondan kopmama adına ürettiği tüm korkuları red ediyorum.artik ilaç kullanmak istemiyorum beyaz kelebeklerin sırlı dünyasını hissetmek adına yeni bir rabıta deniyorum,2018-11-30 22:21:15+00:00,
2222,#ArabeskKafa Didim 'de ilaç gibi #EflatunBar,2018-11-30 22:20:57+00:00,#ArabeskKafa #EflatunBar
2223,"'şeker'insanlığı ilaç bağımlısı yapmak için üretilmiş zehirdir.şekersizyaşamda tansiyon,reflu,vertigo,migren,romatoidartrityok",2018-11-30 22:19:45+00:00,
2224,Parol kadar boş bir ilaç daha yok,2018-11-30 22:19:32+00:00,
2225,"Ben seni unutmam Unutamam Sen beni güzel, güzel hatırla Zaman ilaç derler ya Ellerin neden uzak hala.. Hande mehan",2018-11-30 22:16:01+00:00,
2226,"devlet belirlediği kanser ilaçlarının %75’ini karşılıyo o ilaçlar piyasada yok, en pahalısı olan ilaç var, bu işyerinden birinin annesi için sordum eski işyerinden birine, devletin karşıladığı ilaçlar yok hiçbi depoda, 2 haftada 1000₺, maaşı az olan biri karşılayamaz ölür",2018-11-30 22:12:35+00:00,
2227,"Dizideki kız intihar etmek icin bir avuç ilaç içti çeşme suyuyla , zehirlenecek aptal :)",2018-11-30 22:11:56+00:00,
2228,Pazar günü sınavlar bitiyor. Sonra yolumuzu bulmamız lazım emmi bende sıkışığım bu aralar ilaç gibi gelir valla.,2018-11-30 22:09:55+00:00,
2229,Geçmiş olsun o kadar ilaç içme,2018-11-30 22:08:58+00:00,
2230,"sağlığın nasıl gülüm sen ondan haber ver, ilaç neye yarar vade gelmişse eğer?",2018-11-30 22:06:11+00:00,
2231,İlaç bunlar ilaç... https://www.facebook.com/646977178/posts/10156838794132179/,2018-11-30 22:02:58+00:00,
2232,Tüm khk mağdurlarına ilaç olması dileğiyle... https://youtu.be/ouKOSJw5Diw,2018-11-30 22:02:50+00:00,
