,Text,Date,Hashtags
1103,Geçen seneki program ama yine de gecenin şansı olsa gerek! Tarkan’a layık bir programla canlı söylediğini de tv’lerde izleriz umarım! Ve tabii ki “Olmaz ilaç sine-i sad pareme...” @tarkan,2017-12-31 23:24:35+00:00,
1104,"Söz ilaç gibidir ; Azı yaşatır, Çoğu öldürür... Hz. Ali ( R.A ) ",2017-12-31 23:23:07+00:00,
1105,Bu sistem Türkiyede mutlaka uygulanmalı. Çevreye ilaç bir çok işsize iş kapısı olur. Danimarka’da aynı sistem var süper işliyor.,2017-12-31 23:22:32+00:00,
1106,2 gündür uyumuyorum ilaç almış gibiyim,2017-12-31 23:21:56+00:00,
1107,Olmaz ilaç sine-i sad pareme..,2017-12-31 23:18:24+00:00,
1108,Su an ilac gibi geldin demek ki 2018 de de Tarkan cigimla gececek az onceki kotu surprizden sonra nefes nefesssss yemin ediyorum ,2017-12-31 23:15:18+00:00,
1109,Birkaç saat önce değişik bi ilaç içtiğimi söylemiştim şimdi kabarmaya başladı kollarım,2017-12-31 23:12:02+00:00,
1110,"@NYTmag @HRC_News @fidh_un @ILAC_rebuild @ABANews Indictment sought &gt;15 years prison on charge of ""being a member of an armed terror organisation"" accuses Özdemir of making an effort not to pass the govt bill into law in 2002 including a definition of unarmed terror organisation",2017-12-31 23:10:30+00:00,
1111,"Aşk yarasıdır bu ilaç kapatmaz, verdiğin tesselim beni avutmaz. ",2017-12-31 23:08:28+00:00,
1112,Uzmanlar Federasyonu tüm camiamiza Hayırlı olsun herkesin derdine ilaç olacak bir STK artik hayata geçti çok şükür.,2017-12-31 23:07:07+00:00,
1113,"2017yi hatırlayalım; stres, boşa giden emekler, hayal kırıklıkları, uyku hapları, daha fazla ilaç, biraz daha ilaç. Herkese iyi seneleeerr",2017-12-31 23:04:34+00:00,
1114,"Şaka bir yana, 2016 gibi benim için kötü bir yılın ardından 2017 ilaç gibi geldi, çok şükür. Allah ölüm hastalık göstermesin başka her şey atlatılır, full time pozitifiz bu yüzden. Birlikte nice güzel, mutlu yıllar yaşayacağız inşallah, yeni yılınızı kutluyorum pozitife devammm ",2017-12-31 23:01:44+00:00,
1115,"2018 yılının kellere saç, hastasına ilaç, züğürte para, sıvacıya mala, işsize iş, dişsize diş tinerciye akıl, şikeciye sabır vemesini diler. ŞAMPİYON CİMBOM YAZDIRACAĞIMIZI BİLDİRMEK İSTERİM ! Mutlu seneler!",2017-12-31 23:00:08+00:00,
1116,Pembe sıçabilmek için özel ilaç alıyormuş.,2017-12-31 22:59:26+00:00,
1117,Ey duam! Kalbimin kırılan yanlarına iyi gelen tek ilaç sensin. Elhamdülillah! #İlkSözümüzDuaOlsun @dedodayi_25,2017-12-31 22:49:58+00:00,
1118,"Ağrı çeken şehirlere ilaç dağıtan adımlar attı, şifalı bakışlarla nazarladı, yarası ağırdı lâkin hiç etmedi ses, sessizliğinde merhamet vardı..",2017-12-31 22:41:10+00:00,
1119,"Gözlerimden sıçrayan et parçaları, rica etsem Mutsuzluğumuda götürür müsün?.@ilac_ms",2017-12-31 22:35:50+00:00,
1120,Aq ilacı bir de işe yarasa. Çünkü aşk yarasıdır bu ilaç kapatmaz.,2017-12-31 22:33:16+00:00,
1121,Tanrıya inanmıyorum. Ama seni karşıma çıkaran ilahi bir varlık olmalı. Etrafımdaki onlarva düşüncesiz şımarık ve aptal insanlardan sonra ilaç gibisin.,2017-12-31 22:30:58+00:00,
1122,"Söz ilaç gibidir.. Azı yaşatır, çoğu öldürür... | Hz.Ali (r.a)",2017-12-31 22:29:52+00:00,
1123,"Geri sayımı yaparken tam 2-1 dediğimiz zamanda hastaya ilaç veriyordum. Mesleğimi yaparken yeni yıla girdim. Bir garip hissediyorum kendimi. 3 dakika boyunca şimdi öküz gibi içmek,eğlenmek vardı diye söylendim. 5 dakika boyuncada mesleğimi yaparken yeni yıla girdim diye sevindim",2017-12-31 22:29:50+00:00,
1124,Ey duam! Kalbimin kırılan yanlarına iyi gelen tek ilaç sensin. Elhamdülillah! #İlkSözümüzDuaOlsun,2017-12-31 22:23:27+00:00,
1125,Çaycı doldur ilaç kokulu çaydan Dakika düşelim senelik paydan,2017-12-31 22:22:56+00:00,
1126,"Yeni yılın kellere saç, hastaya ilaç, züğürte para, sıvacıya mala, işsize iş, dişsize diş, olmayana çocuk, üşüyene gocuk, colaya buz, yemeğe tuz, nazar değmişe hoca, evde kalmışa koca, dırdırcıya akıl, onu çekene sabır, vermesini diler mutlu yıllar dileriz. ""Hoşgeldin 2018""",2017-12-31 22:21:21+00:00,
1127,"#YilbasindaBedelli Referandum öncesi verilen sözün tutulmasını bekliyoruz. Ortam uygun, ekonomi ortada... SMA hastaları ilaç bekliyor. Savunma için ek kaynağa ihtiyaç duyuluyor. Ancak devlet bunları vatandaşa zam yaparak karşılıyor. Ne gerek var zamlara? #bedelliaskerlik",2017-12-31 22:20:01+00:00,#YilbasindaBedelli #bedelliaskerlik
1128,Rakı ilaç bira çikolatalı muzu prşprşe yedim midem rahat değil,2017-12-31 21:53:03+00:00,
1129,Valla konuşmak bana da ilaç gibi geldi Murat. Çok teşekkür ederim. Sen de çok seviliyorsun :),2017-12-31 21:48:57+00:00,
1130,He ya abi sorma ilac ariyorum bende icicem ,2017-12-31 21:45:36+00:00,
1131,"bu gece olmadı yarın bunun ödülü ona ulaşacak.İşter çifte ilaç saldırısı, ister indirilen hatimler benden kurtaramayacak.Başındaki aürı karın ağrısıyla karışıp fena kıvrandıracak onu.",2017-12-31 21:43:35+00:00,
1132,"Aşk ne demek bilen varmı, zehir mi yoksa ilaç mı.....??? Tatsam mı acaba tatmasam mı....? https://www.instagram.com/p/BdYc_RGDFTK/",2017-12-31 21:41:49+00:00,
1133,Ağrıdan gebersem de ilaç içemiyorun,2017-12-31 21:30:47+00:00,
1134,Bende icemiyorum ustune afiyet keci gribi olmusum avucla ilac kullaniyorum sarap dolapta iyilesecegim gunu bekliyo,2017-12-31 21:30:26+00:00,
1135,Olm yalnız var ya bi ilaç verdi annem vücudum alev alev yanıyo,2017-12-31 21:29:58+00:00,
1136,Gözüm öyle ağrıyor ki parlaması bile gitti bu yılda acı geçecek . Kalbim bile sızladı @ilac_ms,2017-12-31 21:29:09+00:00,
1137,Millet içki içiyo ben ilaç adaletsizzlik,2017-12-31 21:29:02+00:00,
1138,""" bî-dimâğâna derd ya'nî humâr ehl-i derde ilâc ya'nî şarâb "" derde ilaç, beyinsize dert diyor ŞARAP için...... öyle işte ... https://www.youtube.com/watch?v=ITetp9mCFNY&amp;feature=share",2017-12-31 21:28:46+00:00,
1139,"%20 benzerlikle, Hosgeldin 2018 ilac gibi geldin #MutluYıllar2018",2017-12-31 21:24:18+00:00,#MutluY
1140,#YilbasindaBedelli cok iyi olur ilac gibi @RT_Erdogan,2017-12-31 21:23:46+00:00,#YilbasindaBedelli
1141,2016 gibi bir yildan sonra 2017 ilac gibi gelmisti. 2018in de tum guzellikleriyle kapimizi calmasi dilegiyle ,2017-12-31 21:23:40+00:00,
1142,"Yeni yılın kellere saç, hastasına ilaç, züğürte para, sıvacıya mala, işsize iş, dişsize diş, olmayana çocuk, üşüyene gocuk, colaya buz, yemeğe tuz, nazar değmişe hoca, evde kalmışa koca, dırdırcıya akıl, onu çekene sabır, vermesini diler mutlu yıllar dileriz",2017-12-31 21:19:33+00:00,
1143,"Yeni yılın kellere saç, hastasına ilaç, züğürte para, sıvacıya mala, işsize iş, dişsize diş, olmayana çocuk, üşüyene gocuk, colaya buz, yemeğe tuz, nazar değmişe hoca, evde kalmışa koca, dırdırcıya akıl, onu çekene sabır, vermesini diler mutlu yıllar dileriz",2017-12-31 21:17:03+00:00,
1144,Hemde ilaç gibi yararı olur.,2017-12-31 21:11:14+00:00,
1145,"Tüm akademik yetkileri elinden alınmalıdır. Zira, bilim adamı yalan ve yanıltıcı şeyler söyleyemez, hele hele bunu bilerek yapamaz. Tıpkı, doktorun bilerek yanlış ilaç vermesi gibi.",2017-12-31 21:07:01+00:00,
1146,Utanma kız tamam kendine iyi bak minnoşum ilaç falan al ,2017-12-31 20:50:47+00:00,
1147,Offf şu salaktan sonra ilaç gibi geldi Özkan Uğur ,2017-12-31 20:47:03+00:00,
1148,En acil ihtiyaçlarımızdan... hızlı forvet yokluğu taktik esnekliği çok engelliyor. Vagner Love ya da Sassá ilaç gibi olur,2017-12-31 20:46:58+00:00,
1149,Gazozuna ilaç bile atmicam :d,2017-12-31 20:34:31+00:00,
1150,"2017 harika bir yıldı yürüyün gidin, 2016 gibi allahın belası siktiriboktan bir seneden sonra ilaç gibi geldi, 2017 sen bunlara aldırma aşkım",2017-12-31 20:26:18+00:00,
1151,Hemşire abla babama ilaç verirken döndü durdu bana dikkatlice baktı ve rujun çokkk güzelmiş dedi çünkü benim rujum çünkü benim tarzım tabiki hepsi çok güzel ,2017-12-31 20:26:11+00:00,
1152,2018 herkese ilaç gibi gelir inşallah bütün olumsuzlukların silindiği güzel bir yıl olsun herkese mutlu yıllar ,2017-12-31 20:21:48+00:00,
1153,"Yeni yılın kellere saç, hastasına ilaç, züğürte para, sıvacıya mala, işsize iş, dişsize diş, olmayana çocuk,... https://fb.me/Pj9qWiqj",2017-12-31 20:18:20+00:00,
1154,Şuan da saat 12 benim için çocukların ilaç saati demek iyi geceler,2017-12-31 20:14:39+00:00,
1155,İntihar etmek için ilaç dozu hesaplıyodum. Bi baktım 18 kutu ilaç lazımmış. Vazgeçtim.,2017-12-31 20:14:13+00:00,
1156,Ne güzel ilaç gibi geldi ,2017-12-31 20:11:33+00:00,
1157,Gazozuna ilaç kattim ibnenin sabaha cikamaz ,2017-12-31 20:03:19+00:00,
1158,Victoria's Secret gel artık Yıldız Tilbe'den sonra ilaç gibi geleceksin,2017-12-31 19:57:07+00:00,
1159,"2017, 2016 denen bok gibi yıldan sonra ilaç gibi geldi. Geçen yıla göre daha kötü olan hiçbir şey yok. 2018'de de her şey daha iyi olacak.",2017-12-31 19:54:11+00:00,
1160,Benim de gazozuma ilaç,2017-12-31 19:48:12+00:00,
1161,öğk bunasıl ilaç,2017-12-31 19:46:48+00:00,
1162,"Botoks yerine nefes alın: ""İyi nefes almanın karşılığı olabilecek hiçbir vitamin, ilaç veya… https://goo.gl/fb/BP7SBo",2017-12-31 19:40:46+00:00,
1163,Belki doğru söylüyorsunuz ama anlaşılan bu münferit ama 15 sene öncesinden tüm ülkenin sağlığı batmıştı ilaç tümü paralı ama yinede bulamadın,2017-12-31 19:34:05+00:00,
1164,Çok güzel bi tag olmuş bu hepinize ilaç gibi gelecek şeyler yaşayacağınız sağlıklı mutlu yıllarınız olsun #YeniYıldadaBirbirlerineİlaçOlacakGüzelAilemizŞerefineTümArmyAşklarımKalpleşiyor,2017-12-31 19:29:30+00:00,#YeniY
1165,2017 ye çorba ve büssürü ilaç içerek veda ediyorum çünkü hastayım,2017-12-31 19:28:38+00:00,
1166,Çünkü yoğun geçen iki haftadan sonra bugün tatildi ve bütün günü baş ağrısı çekerek geçirdim yeni yıla böyle girmiyim diye ilaç içtim bakalım geçecek mi ,2017-12-31 19:11:05+00:00,
1167,"Demek ki piyango ne kelliğe ilaç, ne de ruhsal dengesizliğe ilaç...",2017-12-31 19:06:57+00:00,
1168,"Çok güzel bir tag bu ama Bu yılda birbirimizi destekleyip, ilaç olalım inşallah güzel ailem hepinizi morladım #YeniYıldadaBirbirlerineİlaçOlacakGüzelAilemizŞerefineTümArmyAşklarımKalpleşiyor",2017-12-31 19:00:04+00:00,#YeniY
1169,"Pançar kökü,bulgur,ceviz,elma,nar,zeytinyağı ve nerdek (nar ekşisi) Bildiğin ilaç #akdeniz",2017-12-31 18:57:45+00:00,#akdeniz
1170,Gazozuma ilaç da atılmış olapilurrr 112! 112!!!,2017-12-31 18:52:35+00:00,
1171,Yeni yıla mind of mine ve bir şişe ilaç eşliğinde girmeyi planlıyordum Liam sen adamsın,2017-12-31 18:47:49+00:00,
1172,"Zman bu ışte kimine ilaç,kimine de düşman.. çok değil geçen yıl bugün;çok heyecanlı,mutlu bir o kadar da korkulu,biz çoğu şeyi görmek istediğimiz gibi hayal ediyoruz daha sonra da gerçekler acıtıyor işte. (31.12.2016)",2017-12-31 18:46:29+00:00,
1173,"“İnsanlığın huzur ve mutluluğu için İslam’ın dışında bir çare, bir ilaç yoktur.”",2017-12-31 18:44:24+00:00,
1174,"2018 ' de Kellere saç,hastaya ilaç,züğürde para,sıvacıya mala,işsize iş, dişsize diş,olmayana çocuk,üşüyene gocuk, kahvaltıya sucuk,çaya şeker,behlüle bihter,dırdırcıya akıl, onu çekene sabır,yemeğe tuz,kolaya buz,nazar değmişe hoca,evde kalmışa koca nasip eyle Ya Rabbi.",2017-12-31 18:43:52+00:00,
1175,L-carnitin de olabilir. ya abidik gubidik bi sürü ilaç var,2017-12-31 18:40:29+00:00,
1176,Yağ emilimini engelleyip dışkı ile atılmasını sağlıyor. Yağlı yediğinizde direk ishal oluyorsunuz. Gel gelelim kiloya neden olan yağ değil karbonhidrat alımıdır. Karbonhidrat tüketince onu zaten vücudunuzda yağa çevirip kilo alıyorsunuz. Yani bu ilaç yağ bağlamanıza engel değil.,2017-12-31 18:34:10+00:00,
1177,#hbysvekitekadro @RT_Erdogan biz size güveniyoruz sizin sözünüz bize ilaç lütfen kitlere kadro verin bizleri de sevindir . ,2017-12-31 18:30:06+00:00,#hbysvekitekadro
1178,Gozozuna ilaç atılan kızlar için evde ders çalışan kızları üzdüler ,2017-12-31 18:29:37+00:00,
1179," Yeni Yıl; Kellere Saç, Hastasına ilaç, Züğürte Para, Sıvacıya Mala, işsize iş, Dişsize… https://www.instagram.com/p/BdYGYNQnBV-/",2017-12-31 18:24:57+00:00,
1180,Kötü kalp hastalığına ilaç bulamadan öleceksin,2017-12-31 18:20:55+00:00,
1181,"“İnsanlığın huzur ve mutluluğu için İslam’ın dışında bir çare, bir ilaç yoktur.”",2017-12-31 18:20:00+00:00,
1182,"Yeni yılın kellere saç, hastasına ilaç, züğürte para, sıvacıya mala, işsize iş, dişsize diş, olmayana çocuk, üşüyene gocuk, biraya buz, yemeğe tuz, nazar değmişe hoca, evde kalmışa koca, dırdırcıya akıl, onu çekene sabır vermesini temenni eder herkeze mutlu yıllar dilerim...:))",2017-12-31 18:10:33+00:00,
1183,Iniciativa Latinoamericana del Cacao (ILAC): producción del cacao por el desarrollo sostenible #SectoresProductivos http://ow.ly/mHhZ30hsnil,2017-12-31 18:10:08+00:00,#SectoresProductivos
1184,"Yeni yılın hastlara ilaç, züğürde para, sıvacıya mala, işsize iş, dişsize diş, olmayana çocuk, üşüyene ev, yemğe tuz, nazar değmişe hoca, evde kalmışa koca, dırdrcya akıl, onu çekne de sabır vermsini diler mutlu yıllar dilerim. Kısacası mutlu, sağlklı, huzrlu olun #MutluYıllar",2017-12-31 18:08:59+00:00,#MutluY
1185,"O zor zamanlarda öyle biri tanıdım ki ilaç gibi...Nasıl kıymetli,nasıl özel...Allaha şükreder mi insan her hatırladığında,şükrediyorum.Dua edin hep olsun.",2017-12-31 18:05:53+00:00,
1186,"Su şişesi, yanında ilaç kutusu, 9.30’da uyku gelmeden içilen çay.. En az 35 milyonun şu an yaşadığı ...",2017-12-31 18:01:40+00:00,
1187,Engellilerden; muayene ve ilaç ücret farkı ile özel hastanelerde fark ücreti alınmasın - Kampanyaya... http://chn.ge/2C1efj5 @ChangeTR aracılığıyla,2017-12-31 17:56:32+00:00,
1188,"Yeni yıla hasta girmemek için son 24 saatte 13 adet limon, envai çeşit ilaç, alternatif tıp olarak anne ve babaanne yöntemleri denedim.",2017-12-31 17:52:11+00:00,
1189,Bu yeni yılda Kellere saç Hastalara ilaç Zühürtlere para Sıvacıya mala İşsize iş Dişsize diş Olmayana çocuk... https://fb.me/RK4VFyGB,2017-12-31 17:38:45+00:00,
1190,Sene başinda çok istiyordum ama şu an Negredo varken gerek yok..Kevin Gameiro kesinlikle ilac olur...,2017-12-31 17:36:56+00:00,
1191,"Adalet sarayları,hastahaneler, dev ilaç sanayileri kurmak ile övünmek ahmaklıktan başka birşey değil...",2017-12-31 17:28:37+00:00,
1192,"#2018 Yeni yılın :kellere ilaç, hastasına ilaç,züğürte para sıvacıya mala işsize iş dişsize diş olmayana çocuk üşüyene gocuk rakıya buz yemeğe tuz nazar değmişe hoca evde kalmışa koca dırdırcıya akıl onu çekene sabır vermesini dile ",2017-12-31 17:26:17+00:00,
1193,"Zor günlere ilaç gibi geldi, sen çok yaşa Ayşe ",2017-12-31 17:19:45+00:00,
1194,Şimdi bu yavşağa bilim insanı deyip savunan asalak beyinli yaratıklar gerçek bilim insanları tank tüfek ilaç telefon yaparken sizin ateist bilim adamlarınız büst yapıyordu başkada bir boka kafaları çalışmadı... #CelalŞengörAdamOl,2017-12-31 17:16:00+00:00,#Celal
1195,Aldığım ilaç yüzünden saatlerdir uyuyorum galiba 00 ı bekleyeneyeceğim uyumaya gidiyorum siz girin ben sonra gelirim,2017-12-31 17:09:29+00:00,
1196,"Ben de hastayken ilaç içebilmek falan isterdim mesela o yüzden derdinizi •••eyim. Yaşasın yeni yıl, çok kalp.",2017-12-31 17:09:27+00:00,
1197,rüyamda çağlar ebelik okumaya başlamıştı ama sonra anneler hastaneye gitmeden evlerinde kendileri doğurabilsin diye bi ilaç geliştirdi ve ilaç işe yarayınca ebelik mesleğini yok ettiği için okuldan atıldı ilacın ismi de givebirthwithçağlaroğlu idi @caglaralmendi,2017-12-31 17:07:45+00:00,
1198,"Yeni yılın kellere saç, hastasına ilaç, züğürte para, sıvacıya mala, işsize iş , dişsize diş, olmayana... https://fb.me/LIF9b9Jl",2017-12-31 17:01:58+00:00,
1199,$fun $cann Yılbaşı eğlence oyun ilaç coinleri uçuşa geçti. Bunları not alalım seneye erkenden alırız ,2017-12-31 16:59:53+00:00,
1200,Ferhat okadar ruhunu anlayan ona yol gösteren birine ihtiyacı var ki! Azad baba ona ilaç gibi geldi. Umarım oda bir darbe indirmez. En azından aşkı bi yol bulana kadar #SiyahBeyazAşk,2018-01-31 23:56:25+00:00,#SiyahBeyazA
1201,"beynimden ilaç vuruluyorum bazen kendimi tutamıyorum, sorunuzun cevabına gelirsek hanfendi troid sıkıntısı var ama Nesrin Cavad",2018-01-31 23:55:55+00:00,
1202,Allah'a emanet ol..iyi uykular..zannetmiyorum gerçi uyuyacağını ama..dilerim zaman ilaç olur tazelenmiş yarana.. ,2018-01-31 23:55:36+00:00,
1203,Doğru doz doğru ilaç doğru hasta jsjjs,2018-01-31 23:38:25+00:00,
1204,Bskalım önümüzdeki ay nasıl ödenecek? NDiaye parası ilaç oldu.Kulübün içini kemirmişler.,2018-01-31 23:17:26+00:00,
1205,"Allah’a güvenen, teslim olan bir insan şirke girmez. Hasta bir insan eğer “Ben şimdi doktora gideceğim bana bir ilaç verecek o ilaç beni iyileştirecek” derse şirke girmiş olur ... https://adnanoktardiyorki.org/?p=65977",2018-01-31 23:07:52+00:00,
1206,Ajsisjdixkdkxkd ay ama bir de haberleri yok ya bi şey olsaydi bebeğe kadın ilac kullandım zarar görebilir diyince kendimi yere attım koltuktan,2018-01-31 23:06:35+00:00,
1207,"Yıllardır gitmediğim doktor, kullanmadığım ilaç kalmadı ama advantan 10 dk da egzamayı geçiriyor kim ne derse desin yaşasın advantan ",2018-01-31 22:58:09+00:00,
1208,"Yaban eller ilaç olmaz yarama, yüreğinden kan damlayan yar benim Grup Kızılırmak - Deli Fırat @kizilirmakilkay",2018-01-31 22:57:29+00:00,
1209,Gazze'deki hastanelerde temel ilaç listesinde büyük eksiklikler var. İlaçların yüzde 45'inin tamamen tükendiğini ve gelecek günlerde bu oranın yüzde 61'e yükselecek #gazzeelektrikilaç #gazzefilistinabluka #gazzehalkıkriz #gazzekriz #gazzesağlıkkrizi https://filistinhaberajansi.com/gazze-elektrik-ilac-krizi/,2018-01-31 22:56:37+00:00,#gazzeelektrikila #gazzefilistinabluka #gazzehalk #gazzekriz #gazzesa
1210,Maşallah ilaç ehil elden olunca mutlak şifa bulacak,2018-01-31 22:52:46+00:00,
1211,5 reasons to prepare for Cambridge exams at ILAC https://nicol29ad.tumblr.com/post/170357496647,2018-01-31 22:51:17+00:00,
1212,"Medeniyeti olmayan,Sömürgeci İşgalci Avrupa ve Batı’nın Kanlı Tarihi.İKİYÜZLÜ Avrupanın Demokrasi yalanı.O öyle bir Avrupa ki;İşgal eder,demokrasi der.Silah satar,barış ister. Virüs yayar,ilaç satar. İnsan öldürür,insan haklarını savunur.Soykırım ve Vahşet. #FransaCezayirSoykırım",2018-01-31 22:45:04+00:00,#FransaCezayirSoyk
1213,5 reasons to prepare for Cambridge exams at ILAC https://aira26soonas.tumblr.com/post/170357514604,2018-01-31 22:44:26+00:00,
1214,"Medeniyeti olmayan,Sömürgeci İşgalci Avrupa ve Batı’nın Kanlı Tarihi.İKİYÜZLÜ Avrupanın Demokrasi yalanı.O öyle bir Avrupa ki;İşgal eder,demokrasi der.Silah satar,barış ister. Virüs yayar,ilaç satar. İnsan öldürür,insan haklarını savunur.Soykırım ve Vahşet. #FransaCezayirSoykırım",2018-01-31 22:42:09+00:00,#FransaCezayirSoyk
1215,"Zaman ilaç derler. Yalan be büyük yalan ..... o gittiği gün yaktığı kıvılcım,, yangın oldu bugün ...",2018-01-31 22:41:02+00:00,
1216,Milleti resmen hapçı yaptılar... Kişi başı ilaç tüketimi 28 kutuya çıktı | https://shar.es/1NKRJL,2018-01-31 22:39:56+00:00,
1217,Bir doktora görünürsen için rahatlar o sana daha güzel anlatır hem de belki ilaç verir mide asidi düzenleyici çok çok geçmiş olsun sakın meraklanma kendini sıkma ,2018-01-31 22:39:18+00:00,
1218,Her derde ayrı bir ilaç yaratan yüce Allah’a sonsuz hamdüsenalar olsun...,2018-01-31 22:37:29+00:00,
1219,"Medeniyeti olmayan,Sömürgeci İşgalci Avrupa ve Batı’nın Kanlı Tarihi.İKİYÜZLÜ Avrupanın Demokrasi yalanı.O öyle bir Avrupa ki;İşgal eder,demokrasi der.Silah satar,barış ister. Virüs yayar,ilaç satar. İnsan öldürür,insan haklarını savunur.Soykırım ve Vahşet. #FransaCezayirSoykırım",2018-01-31 22:32:05+00:00,#FransaCezayirSoyk
1220,Kişi başı ilaç tüketimi 28 kutuya çıktı https://ahvalnews.com/tr/node/6225#sthash.NNdQlHfs.uxfs,2018-01-31 22:31:41+00:00,
1221,Miğdemde kıpırdamalar hissediyorum. O kadar ilaç var ki şu an hepsi içeri de kavga ediyor olabilir ,2018-01-31 22:31:07+00:00,
1222,Bu gaviscon tam bir harika. İnanılmaz bir ilaç.,2018-01-31 22:22:35+00:00,
1223,Neden benim sana zaafım Gönlüme ilaç mı attın nediirr ,2018-01-31 22:20:21+00:00,
1224,"Toplu ilaç alımlarında ki eşantiyonlarla ilgilenmek istiyorum artık ya; Laptop olur, koşu bandı olur , yurtdışı gezisi olur, olurda olur kjkjkjkjkjk Diş macunu diye düşünen varsa takibi bıraksın lütfen üzmeyin beni ",2018-01-31 22:19:16+00:00,
1225,Yalnız ilaç çok etkili izlerken bile isteğimi arttırdı hemen lavaboya gitmem lazım ,2018-01-31 22:19:09+00:00,
1226,"Kadin pedi gibi siradan, masum bir ihtiyacin reklami icin kelle isteyen yavsagin insanlarda kalici hasar birakabilecek hatta olume goturebilecek sahte ilac satislarindan dolayi KELLESINI ISTIYORUZ ",2018-01-31 22:18:48+00:00,
1227,problem şu; neden yasa dışı ilaç tanıtımı yapmaktan daha önce alınmadı kendi kellesi de tepki görünce alındı?,2018-01-31 22:15:48+00:00,
1228,"Po m'vjen keq me ja bo unfollow bre, a keni ilaç?",2018-01-31 22:15:28+00:00,
1229,hayatına iyilik kat sibel ayşe yücel özel meleklerine ilaç arıyor - Gazi45Radyosu http://www.gazi45radyosu.com/haber/6122/hayatina-iyilik-kat-sibel-ayse-yucel-ozel-meleklerine-ilac-ariyor.html,2018-01-31 22:14:34+00:00,
1230,Daha da ilac almam senden,2018-01-31 22:13:28+00:00,
1231,Ağrılarım azalsın diye doktora gidiyorum doktor ilaç veriyo ağrılarım azalacağına ilacın yan etkisi yüzünden dahada artıyo BU HAYATTA BENİM CANIMIN Bİ KIYMETİ YOK ZATEN,2018-01-31 22:11:01+00:00,
1232,İnternetten ilaç satışı yasal değildir. Halk sağlığıyla oynayanlara prim vermeyiniz. ,2018-01-31 22:10:16+00:00,
1233,"Bence bosanma kararinda degisen bisiy yok. Ben fragmanda sadece ask, tutku,aci ve caresizlik gordum. Cakma opusmelerden sonra bu arkadan sarilma ilac gibi geldi Asli dik duracak gibi sanki, hosuma gitti. #SiyahBeyazAsk",2018-01-31 22:09:51+00:00,#SiyahBeyazAsk
1234,bu ilaç ne işe yarıyo,2018-01-31 22:07:35+00:00,
1235,@UN yalanlarınızın amk birleşmiş milletlermiş ulan sizden büyük ilaç mübessili yok ulan bu dünyanın öteki tarafı da var,2018-01-31 22:03:12+00:00,
1236,Eczacı; kimyasal gereçlerle ilaç yapan ya da hazır ilaçları satan kimse.. Eczacılık; eczacı olabilmek için alınması gereken eğitimdir..,2018-01-31 22:02:49+00:00,
1237,Maranki Sahte ilaç satmaktan yargılanacakmış... Demedi demeyin ,2018-01-31 22:01:43+00:00,
1238,Abim ilaç içti salak baktım dolaptan içki çıkarıyo napıyosun sen ilaç içmedin mi diyorum aaa unuttum diyo dşdjdld bana bi hayat borçlu artık,2018-01-31 22:00:27+00:00,
1239,"TRT'de yayınlanan Payitaht ""Abdülhamit"" ve Diriliş Ertuğrul dizilerinin aralarında kadın pedi ve gazlı içecek reklamları bulunduğu için ""Bu reklamlara göz yumanların kellesi alınmalı"" diyen Ahmet Maranki'ye, yasadışı ilaç tanıtımı yaptığı gerekçesiyle soruşturma başlatıldı. ",2018-01-31 22:00:02+00:00,
1240,"Zamanın ilaç olduğu an, senin bir şeyleri kabullendiğin andır. Sen kabullenmediğin sürece geçen zaman yalnızca pişmanlıktır.",2018-01-31 21:57:44+00:00,
1241,oturduğum yerden hasta oluyorum aq hiçbir şey yapmasam bile hasta oluyorum sanırım yeniden ilaç kullanmalıyım veya spor sağlıklı yaşam hebele hübele,2018-01-31 21:57:34+00:00,
1242,Osmanlı maçına çıkmaması da bilinçli bence. Gitmek istediğini başka şekilde ifade edemeyecegini düşündü. Futbolu için diyecek bişey yok. Melodan sonra ilaç gibi geldi.,2018-01-31 21:56:30+00:00,
1243,Ya allah askina durun kulup borc batakliginda €16M ilac gibi gelecek bu donemde daha oyuncularin maaslarini oduyemiyoruz,2018-01-31 21:56:28+00:00,
1244,‘Zararı olmayan ilaç yoktur’ İyi geceler.,2018-01-31 21:55:05+00:00,
1245,Sana özel doktora git diye zorlayan varmı ama önce devletten maaş alıp yazihaneme gel diye zorluyorlardi yazihaneye gitmessen 9 gün değil 9 AY gün veriyorlardı 9 ay sonra bakıyor 3 ilaç yazıyor ama ilaç almak içinde bir hafta ugrasiyordun sigortaliysan eczane ilaç vermiyor d,2018-01-31 21:54:46+00:00,
1246,!!! Milli ilaç Sanayi en az Milli Silah Sanayi kadar önemlidir..,2018-01-31 21:53:48+00:00,
1247,'Tabiplerde ilaç yoktur yarama!!' ... ,2018-01-31 21:41:26+00:00,
1248,"Her şeyin ithalatı serbest - futbolcu,pilot,doktor,saman, et, ilaç, mülteci vs ve hatta mama-iş hakeme gelince önce vatan ????",2018-01-31 21:39:35+00:00,
1249,"bazen o kadar çirkindir ki, kendi gazozuna ilaç atarsın",2018-01-31 21:38:14+00:00,
1250,Hastane koridorları ilaç değil acı kokar,2018-01-31 21:30:45+00:00,
1251,Ped reklamına idam isteyen Maranki'ye 'sahte ilaç' pazarlamaktan soruşturma! https://goo.gl/xDn2ex,2018-01-31 21:30:00+00:00,
1252,"Zaman hayattaki en zehirli ilaç. Bir şeylerin unutulmasını sağlarken benden aldıklarıyla, beni bambaşka bir insan yaptığında anladım.",2018-01-31 21:28:30+00:00,
1253,"İnsan yan etkisi, ilaç yan etkisi...",2018-01-31 21:28:03+00:00,
1254,gönül yarası bu ilaç kapatmaz,2018-01-31 21:27:34+00:00,
