,Text,Date,Hashtags
3114,Sonra o kediyi aldım gözlerini temizledim ama merhem ve ilaç gerek beni annesi sanıyor yavrucağızım,2019-08-31 23:09:26+00:00,
3115,"Hayırlı Geceler Olsun İnşallah Cemal Bey Hangi doktor ilaç verir bu derde Zaman kısa,yol uzun Yorgunum.... Yüreğine Sağlık",2019-08-31 23:07:59+00:00,
3116,"Ahmet Türk bizati Devlet Bahçeli'nin kankisi, hapisten çıkaran o,,adam pkk li tedavi etmiş ve ilaç vermişse neden hapiste değil bunuda açıklayın aceba o kimin kankisi",2019-08-31 23:04:40+00:00,
3117,FB’nin Gustavo transferi 900 bin euro için iptal noktasındaymış. Adamı izlemedim ama ilaç olacak adamsa 900 icin alamamak can yakar,2019-08-31 23:04:36+00:00,
3118,"HIV virüsün adı, HIV+ olmak da virüsü taşıyor demek ama hasta olduğu anlamına gelmez (AIDS hastalığın adı ve hemen ortaya çıkmıyor). Düzenli ilaç aldıkları sürece insanlar hayatına sağlıklı ve normal bir şekilde devam edebilirler. Hatta HIV- çocuk sahibi bile olabilirler.",2019-08-31 23:04:23+00:00,
3119,Bilmiyorum saymıyorum ben kaç ilaç yuttum,2019-08-31 23:03:12+00:00,
3120,Herşey çok güzel olmuş. Herkes birbirini kucaklasın diyor pkk ya destek isterken. Bu istanbul çok mutlu çok. Nankörlüğe ilaç varmı ki,2019-08-31 22:59:47+00:00,
3121,"Bunun üstüne bi Simon kjaer,Diagne'den kurtulup bi Cenk Tosun'u kiralamak ilaç gibi olur....",2019-08-31 22:58:01+00:00,
3122,Hemen yan komşuya git belki onlarda ilaç vardır diyemiyorum çünkü bu devirde komsuluguda öldürdüler,2019-08-31 22:57:37+00:00,
3123,"seni en son gördüğümde hala bir çocuktum bilmiyorum,saymıyorum ben kaç ilaç yuttum",2019-08-31 22:56:50+00:00,
3124,Geçmişin geçmesini beklemek hastayken ilaç almadan iyileşmeyi beklemek gibi #picemiyeti,2019-08-31 22:55:45+00:00,#picemiyeti
3125,O teyzelere yazılan ilaçların çoğu gereksiz ve ilaç mümessillerinin gazı (o gaz ve motivasyon neyle sağlanıyor girmiyorum oralara) ile yazılan ilaçlar ayrıca teyzelerin çoğu hastalık hastası...,2019-08-31 22:53:31+00:00,
3126,Arkadaş Simon Kjaer bu takımın defansına ilaç olur,2019-08-31 22:53:11+00:00,
3127,Her zaman söylerim sarılmak en iyi ilaç... ,2019-08-31 22:50:20+00:00,
3128,Halkımız çiçektir diyorlar işte daha ne istiyonuz. Çiçekte sulanmalı. İçinde ilaç katılıyor ki sağlıklı olalım biber gazı en iyi c vitamini daha ne isteniyor anlamıyorum,2019-08-31 22:49:05+00:00,
3129,Eveet AKP nin bakanı... Düzce'de son durum nedir??Nuri Alço filmlerine çevirmişsiniz orayı! Kadının içeceğine ilaç katmak nedir ya?? ,2019-08-31 22:42:20+00:00,
3130,Bazen uyumak en güzel ilaç,2019-08-31 22:32:15+00:00,
3131,15 gün de Falcao fiziken de hazır olur. şu 3 puan ilaç oldu.,2019-08-31 22:27:48+00:00,
3132,Anderlecht 5+10 zorunluyu bugun duydum bende keske oyle olsa be ilac olur ,2019-08-31 22:25:24+00:00,
3133,"İnsanın yanında ilaç gibi insanlar olmalı; Ağrılarını dindiren, yan etkisi olmayan. #GeceyeNotum",2019-08-31 22:22:43+00:00,#GeceyeNotum
3134,"Gol kısırı bence, forvette gerçekten Beşiktaş a ilaç olabilecekmi ?",2019-08-31 22:17:48+00:00,
3135,"İçeri alacağız doktor bedava,ilaç bedava,nasıl olsa maaşta var,deniz kenarında nargile tüttürecekler o zaman kahraman Türk ordusu öyle mi.Hadi oradan yavşaklar.",2019-08-31 22:15:09+00:00,
3136,ayıplı bişeyler yapmışlar hem de gazozuna ilaç atmışlar gruplu felan ,2019-08-31 22:14:16+00:00,
3137,korkma ya doktora git ilac verir bir iki haftaya gecer,2019-08-31 22:13:52+00:00,
3138,Edip kaşınmak senin işin bizler uyuzlardan uzak duruyoruz . sen ve senin gibiler sahibiniz Amerika sokaklarında ilaç arayın .,2019-08-31 22:13:15+00:00,
3139,bu ilac niye bu kadar pahali aq,2019-08-31 22:12:21+00:00,
3140,ilaç vermiyolar mı :d,2019-08-31 22:07:58+00:00,
3141,"Hayatta en büyük zenginlik, ilaç gibi sana iyi gelen bir dostunun olmasıdır ve böyle dostun olduğu sürece yıkılmazsın.@nhlldmrbs",2019-08-31 22:06:44+00:00,
3142,Tam da şu sıralar ilaç gibi geldi ,2019-08-31 22:06:11+00:00,
3143,Hocam ben çok hastayım allah rızası için son isteyim bugün bu şikecileri yenmeniz bu bana ilaç gibi gelecek şırnaktan selamlar,2019-08-31 22:02:55+00:00,
3144,"Pozitif enerji pozitif şeyler doğurur diye düşünüyorum. Avcı'nın maç sonu verdiği istatistikler çok önemliydi bence, oyun oturuyor forvetle uçarız gibi... ligde izin vermezlerse kalitemizi Avrupa'da gösteririz. Şahsen geçen haftaki rezil futboldan sonra ilaç gibi geldi bugün :')",2019-08-31 22:01:26+00:00,
3145,Milli ara bizim için resmen ilaç olacak. Formsuz olan oyuncular ve doğru düzgün kamp görmeyen oyuncular için büyük fırsat. Özellikle de Falcao için çok iyi olacak. Milli aradan sonra inşallah çok daha iyi döneriz.,2019-08-31 22:01:18+00:00,
3146,Hacı amca nerde ilaç fln verseydi :),2019-08-31 21:59:22+00:00,
3147,Amokachi ilaç olur,2019-08-31 21:57:29+00:00,
3148,Fb elimizden vedat i aldı biz daha iyisi falcao 'yu aldık onlar deniz i biz e.mor u aldık Şimdi elimizden Mevlüt u aldılar Cenk ilaç gibi gelir,2019-08-31 21:56:52+00:00,
3149,teknik sebeplerden dolayı timelapse olayını yapamadım. şu fotoğraf ile geceye noktayı koyuyorum. 3 aylık yoğun tempolu çalışma sonrası ilaç gibi geldi bu 2 günlük kaçamak. sevgiler. dipnot: herhangi bir efekt yada oynama yok. #milkyway #stars #Astrophotography #universe,2019-08-31 21:54:15+00:00,#milkyway #stars #Astrophotography #universe
3150,"Akp Düzce İlçe Yöneticisi biri, yine ilçe sorumlusu olan bir kadının gazozuna ilaç atıp Sapancada bir otelde halvet etmiş. Sonra bu kadını grup halinde şey etmişler. Sonra ev tutmuş orda şey etmiş. İşte bu haberle ilgili yayın yasağı gelmiş. Denk gelirseniz paylaşmayın lütfen..",2019-08-31 21:53:49+00:00,
3151,umarım eylül ilaç gibi gelir çünkü fazlasına ihtiyacım var,2019-08-31 21:53:31+00:00,
3152,Falcao vayt çaklıt mokama ilaç at gıkım çıkarsa şerefsizim,2019-08-31 21:52:40+00:00,
3153,Dil altımın kuruması normal mi ilaç yoksunluğu mu başladı,2019-08-31 21:41:35+00:00,
3154,Bence son sn bi fernandes hamlesi gelmeli su yoklukta ilaç olur,2019-08-31 21:40:33+00:00,
3155,Kamil Wilczek bize ilac olurdu :),2019-08-31 21:40:24+00:00,
3156,Hic fena ilac degil ama,2019-08-31 21:38:53+00:00,
3157,@ersinduzen INŞALLAH cenk geri gelir beşiktaş acilen gelsin ilaç gibi adam,2019-08-31 21:36:52+00:00,
3158,Ortalık Tosun Paşa kiralanabilir ve Falcao yedeklenir. Simon Kjaer adı geçmeye başladı Stopere ilaç geliyor.. O.saha için ne olur bilinmez Fernandes bile olabilir..,2019-08-31 21:34:17+00:00,
3159,"Allahım, 5 ay sonra ilaç gönderdin sana şükürler olsun",2019-08-31 21:33:07+00:00,
3160,Valla hocam Twitter hayatınız niçin bitecek orasını bilmiyorum ama bu tür tweetleriniz şu streste ilaç gibi geliyor. Güldürdünüz beni yine. Allah da sizi güldürsün ne diyeyim. ,2019-08-31 21:31:03+00:00,
3161,And the ST Star Vocational College winner is...ILAC International College! #STStarAwards19,2019-08-31 21:27:11+00:00,#STStarAwards19
3162,"Havası ilaç, denizi kitap bir yerlerde... ",2019-08-31 21:26:34+00:00,
3163,Bütün suç Nuri Alçonun. Gazoza ilaç ha? @nurialco,2019-08-31 21:26:28+00:00,
3164,Gece gece ilaç gibi geldin..huzur veriyorsun @emircanigrek,2019-08-31 21:24:42+00:00,
3165,Ya biraz sağlıklı düşünün amk. Arsenal - liverpol maçını 89. dakikada açtım maç yeni başlamış sandım. Adamlar kondisyonda başka evrende. F.T. bunun farkında hayvan gibi yükleme taptı takıma... 7 sekiz hafta zaman lazım. Milli maç arası ilaç taktik ant. için. Adam planlıyor mk,2019-08-31 21:23:47+00:00,
3166,Biz de eğlenmek için ilaç ve takviye alıyoruz askajsajkaak Coğrafya kaderdir ,2019-08-31 21:23:36+00:00,
3167,Bir Kur'an iki kitap okumak. İlaç ilaç...,2019-08-31 21:21:22+00:00,
3168,Ben takımı beğendim. Bu takım iyi bir forvet ile çok dinamik olabilir. Elneny ile pas alışverişi daha çabuk olabilir ama kaybedilen 5 puanı heleki bu maçtaki 2 puanı çok ararız. Söylüyorum. Ozzy bitti. Elneny ve Dorukhan orta sahası çok iyi olacak. Milli ara ilaç olur.,2019-08-31 21:21:06+00:00,
3169,Ağrılarına ilaç olurum ama yan etkilerine dayanamazsın,2019-08-31 21:20:44+00:00,
3170,adebayor ilaç olurdu,2019-08-31 21:19:22+00:00,
3171,Oğuzhan 6 numara oynadığında çok yumuşak kalıyor Elneny o bölgeye ilaç olacaktır.N’Koudou oyuna girdiğinden maç bitimine kadar elinden geleni yaptı.Form tuttukça etkili olacak.Lens bu takımın sinerjisi ile uyuşmadı.,2019-08-31 21:16:54+00:00,
3172,"Doğalgaz zammı Botaş’tan, akaryakıt zammı PUİS’ten, elektrik zammı TEDAŞ’tan, ilaç zammı eczacılardan, çimento zammı TÇMB’den, hastane zammı OHSAD’dan, işçiye komik zam Türk-İş’ten, memura komik zam Hakem heyetinden, Burhan abiye kalan süte değmiş ak kaşık",2019-08-31 21:14:36+00:00,
3173,Eylül ayı umarım ilac gibi gelirsin sanmıyorm ama yine de inandırmaya calıscam kendimi,2019-08-31 21:13:48+00:00,
3174,Adem Ljajic takımda en beğendiğim oyuncuların başında geliyor ama 3 maçtır eski Adem Ljajic'i izleyemiyoruz. Bir de gereksiz kartlar görüyor. Ljajic toparlamazsa Beşiktaş'ın şampiyonluk şansı azalır. Milli ara ilaç gibi gelecek.,2019-08-31 21:10:26+00:00,
3175,Yönetim senin kanayan yarana ilaç almıyor forvet almıyor... Konoplyanka alıp hiç saçını tarar mı?,2019-08-31 21:06:03+00:00,
3176,Ben artık uzman dr da güvenemiyorum kırk yılın başı baş dönmesi mide bulantısı diye dr gittik kan testi mr sonuç Vertigo dedi ilaç raporu pat 16 kutu ilaç Kaç tanesini içtim sadece birer kutu 9 aydır gerisi öyle duruyor bu SGK bütçesi açık vermesin de ne yapsın,2019-08-31 21:04:32+00:00,
3177,Kullanılacak ilaç iğne vb içeriğinde hayvansal madde yoksa problem değil,2019-08-31 21:03:32+00:00,
3178,Ben takımı beğendim arzusu temposu yükselmiş ama pas trafiği hala oturmadı en az 4-5 hafta sürer tahminim Elneny bu takıma ilaç gibi gelir tabii bide forvet ama ilk yarıda ki pozisyonları değerlendirsek onu da konuşmayacaktık,2019-08-31 21:02:16+00:00,
3179,Kasımpaşa maçına kadar Falcao takıma da uyum sağlar. Milli ara hem uyum için hem takımın genel formu için ilaç gibi gelecek. Hazırlık maçı da ayarlanırsa süper olur kanaatimce.,2019-08-31 21:01:37+00:00,
3180,Super. Ratosyona ilac olur.,2019-08-31 21:00:12+00:00,
3181,"büyük ihtimalle apse yapmıştır ve doktor iltihabı kurutmak için antibiyotik verecektir, ilaç bitince dişini tedavi ettir",2019-08-31 20:59:13+00:00,
3182,"2 penaltıyo verse bu pozisyonşara gerek kalmıycak beybisi, sabret ama milli takım arası bize ilaç gelecek",2019-08-31 20:57:26+00:00,
3183,"Kötü oynamadık. Şanssızdık, zemin kötüydü, hakem berbatti, 2 net penaltımız verilmedi. Değişiklikler kötüydü. Yapacak bişey yok önümüze bakacağız. Ayaga kalkın. Milli ara ilaç olacak ilaç.",2019-08-31 20:54:45+00:00,
3184,Konyaspor’da kreatif futbolcu eksikliğinden Farouk Miya ilaç gibi geldi. İnşallah form durumu böyle devam eder. Siz ne düşünüyorsunuz ? ,2019-08-31 20:53:39+00:00,
3185,Adam #Stachowiak 3 haftadır penaltı kurtarıyor. Adeta takıma ilaç oluyor. #Denizlispor,2019-08-31 20:50:42+00:00,#Stachowiak #Denizlispor
3186,"Sic transit gloria mundi (""Böyle geçer dünyanın ihtişamı"" mânâsında Latince deyim.) A. Çehov'un 'Duruşmadan Önceki Gece' isimli hikâyesindeki sahte doktor reçetesine ilaç niyetine yazıyor bu deyimi. İlaç; dünyadaki bütün ihtişamların geçiciliğini idrak etmek değil mi?",2019-08-31 20:49:13+00:00,
3187,Yok hükmünde bir Sivas maçı Göztepenin ilkinci yarısı bu maçın büyük bir kısmı ilerleme olmasına rağmen eksik hala çok. 2 Eylül’e kadar gereksizleri gönderip en az bir forvet takviyesi şart. Milli ara ilaç olur umarım @Besiktas,2019-08-31 20:48:08+00:00,
3188,hiv+ olmak da hastalığa değil virüse sahip olmaktır ilaç kullanıp hiv+ olan insana taşıyıcı denebilir ama hastalığı yoktur. bu kadar.,2019-08-31 20:47:04+00:00,
3189,kadınlar macar ikiye bir gurup hastaya verilen bir ilaç gibi gelmişti ama bu fenâ duman beni başka bir yaşıma ....,2019-08-31 20:45:38+00:00,
3190,Sesi ilaç gibi ,2019-08-31 20:43:30+00:00,
3191,Yüzüme gülen yarama hiç ilaç olmaz,2019-08-31 20:41:32+00:00,
3192,"Jimin ilaç gibisin bana nasıl mutlu olup nasıl gülümsediğimi bir ben biliyorum tüm endişeler silindi bende sana kıyamıyorum Ve kızamıyorum resmen. Löp löp yanaklarından, gülüşünden, bakışından öpüldün jiminşi ",2019-08-31 20:38:10+00:00,
3193,Nuri alçı gibi gazozuna ilaç koyup uyuyuşunu sabaha kadar izlemek isterdim,2019-08-31 20:37:18+00:00,
3194,Hangi ilaç?,2019-08-31 20:36:42+00:00,
3195,Çin’in en zengin çifti artık ilaç sektöründen https://cinhaber.net/ekonomi/cinin-en-zengin-cifti-artik-ilac-sektorunden-h1762.html,2019-08-31 20:35:49+00:00,
3196,İnşallah yaa diagneden sonra ilaç gibi olucak bize,2019-08-31 20:35:48+00:00,
3197,Inşallah takıma yararlı olur insallah 2 sezondur çektiğimiz forvet şansızlığını o ilaç olarak gelir,2019-08-31 20:34:27+00:00,
3198,"Ey can ben ve sen hüzün ruh halim İnan bana… Ama yok. Başka çare yok. Unutma ki ilaç bile beklemeden tesir etmez, çiçek bile vakti gelmeden önce açmaz…",2019-08-31 20:30:16+00:00,
3199,En basiti Bir gün baş dönmesi mide bulantısı ile hastaneye gidin Kan testi mr ne varsa yapılıyor Vertigo deniyor 8 er kutu toplam 16kutu ilaç verilip rapor çıkarılıyor Ve o ilaçlar hiç içilmiyor çöp oluyor İşte SGK böyle böyle batıyor Bunların değişmesi lazım ama nasıl,2019-08-31 20:28:18+00:00,
3200,O ilaç yüzünden cinsel organı kesildi! Siz de kullanıyor olabilirsiniz! ,2019-09-30 23:58:00+00:00,
3201,Bu gece uyanmalarına son veren bi ilaç var mı? ,2019-09-30 23:55:33+00:00,
3202,"#elektrik zamlandıysa doğalgaz zamı da yakındır, hatta ekmek şu ilaç vs. zamlarına hazır ol Türkiyem.",2019-09-30 23:52:07+00:00,#elektrik
3203,Bazı boşluklar dolmuyor.. Ve en çok geçen yıllara üzülüp bir daha o zamanların gelmeyeceğini düşünerek daha çok kahroluyorum. Anı yaşamak nedir bilmiyorum. Ya gelecek kaygısı ya da geçmişin ızdırabıyla kuşanıyorum. Zaman ilaç demişler.. Bu duruma bakınca benim zehrim oluyor..,2019-09-30 23:49:28+00:00,
3204,ustam erdoğan ne yaptıda bunlara sevmiyorlarki okulda çocuğu varsa kitap bedava hastanede hastası varsa ilaç bedeva daha ne yapalım ağzımızla kuş tutsak severlermiki,2019-09-30 23:48:56+00:00,
3205,"Bunlar Kütahya ile Bursa arasında. Sadece yaprak yiyerek yol açtıkları şey insanı tedirgin ediyor di mi? Hah. Şimdi... insan türünün aşırı üremesiyle yaptıkları diğer tüm türlerin, tüm gezegenin hatta gezegenin çevreleyen katmanların bile ammmına koyuyor. Bize kim ilaç sıkacak?",2019-09-30 23:45:25+00:00,
3206,180 mi... Harbiden uyutuyormuş ilaç...,2019-09-30 23:42:05+00:00,
3207,"Çok agresifsin, bi ilaç falan mı alsan :)",2019-09-30 23:40:13+00:00,
3208,Aynen güya uyku getiren ilaç içtim hâlâ uyuyamadım,2019-09-30 23:40:05+00:00,
3209,"Bizden önce verilen şeyleri bu milletin seçtiği iradesi vermedi zaten Ülkemiz işgalden kurtuldu ama bir borçla 1947 den beri prangalıyız. Unutmayın ekonomisi olmayan devlet köle olmaya mahkumdur. Halkımızın durumu ilaç, gıda ve temel ihtiyaç sıkıntıları çok eskidir.",2019-09-30 23:38:50+00:00,
3210,Hayat kısa size değer vermeyeni kesip atin hayatinizdan .önünuzdeki mutluluklarin kaçip gitmesine izin vermeyin.zaman ilaç değildir hiç bir zaman geçip giden her dakika sizin ömrünüzden gider bu yüzden hic biseyi http://xn--geiktirmeyin-ldb.geçikken her şey yok olmaya mahkumdur.,2019-09-30 23:32:29+00:00,
3211,Fácil decirlo... pero como cuesta dar con ese instante...,2019-09-30 23:27:48+00:00,
3212,pelin hasta olmuş evdeki bütün ilaçları içmek istiyo neden diyorum uykumu getirsin diye diyo sonra bi ilaç ismi soruyo antibiyotik o diyorum antibiyotik uyku getirir mi diyo,2019-09-30 23:23:55+00:00,
3213,"Zaman her şeyin ilacı sözündeki ilaç parol galiba, gram etkisi yok.",2019-09-30 23:19:19+00:00,
3214,Bir sürü ilaç alıp uykuya dalma fikri nasıl güzel ama,2019-09-30 23:18:20+00:00,
3215,"İlaç sorguladım, verilen cevaba bak; ""Bu ilaç, psodöefedrin hidroklorür sistemik bir nazal dekonjestandır."" Bu açıklamadan anlasaydım doktor olurdum zaten aslanım. (Allah bu sağlıkçı egosunu kahır eyleye .)",2019-09-30 23:15:45+00:00,
3216,"Artık ölüm raporlarımıza, ZAM yazarlar. Hadi sigarayı sağlığımıza zarar veriyor diye zam yapıyorlar. Elektiriğe,benzine,muayene ve ilaç katkı paylarına yaptıkları zamlar için hangi sebebe sığınıyorlar?",2019-09-30 23:07:31+00:00,
3217,"DEPREME karşı “tedbir alan tek kurum mezarlıklar müdürlüğü!” Mezarlıklar müdürlüğü,1 milyon mezar kazdırmış,1 milyon tabut yaptırmış,1 milyon ceset torbası ve açıkta kalacak cesetlerin kokmaması için yeteri kadar ilaç sipariş etmiş.",2019-09-30 23:06:54+00:00,
3218,"umutlarımı henüz kendi başına ilaç bulamamışken bana ilaç tavsiye edenler için yıkacak değilim. Ufak bir şey mutlu eder beni büyük beklentiler içerisinde değilim , fazlasına gözüm yok .. kalbimi hevesimi kırmayın yeter.",2019-09-30 23:05:28+00:00,
3219,"Devlet hastanesinin zahmet edip hiç bir test yapmadığı bırakın test yapmayı,doktorun yerinden kalmadan ilaç yazdığı kol ağrıma özel hastane de kırık denildi. (Devlet hastanesine gideceğine eczaneye git daha iyi) tam olarak o kadar yani.",2019-09-30 23:02:45+00:00,
3220,Rabbim sağlık ve afiyet versin. Uzun ve ilaç kullanmadan bir ömür geçirmeyi nasip etsin,2019-09-30 23:01:33+00:00,
3221,Aynen emmi ilaç içtim ter atıyorum şuan ,2019-09-30 22:52:07+00:00,
3222,zaman ilaç derler ya ellerin neden uzak hala,2019-09-30 22:52:07+00:00,
3223,Psikiyatrine söyle sana ve bana ilaç yazsın. İyi geceler tatlı rüyalar. Çok üzgünüm seni meçgül ettiğim için.. Birdaha asla olmayacak.. Amına koduğumun akıllıları.,2019-09-30 22:46:18+00:00,
3224,"Depreme karşı “tedbir alan tek kurum mezarlıklar müdürlüğü!” Mezarlıklar müdürlüğü,1 milyon mezar kazdırmış,1 milyon tabut yaptırmış,1 milyon ceset torbası ve açıkta kalacak cesetlerin kokmaması için yeteri kadar ilaç sipariş etmiş... yuuhhhh....",2019-09-30 22:45:10+00:00,
3225,Sana göre aşk oyun saklambaç Bana göre her derde ilaç Nerde eski sevgiler Şimdi oldu hep Vur Kaç...,2019-09-30 22:34:19+00:00,
3226,#BeratAlbayrak Ağzını açtıysa bilinki zam kapıda demektir.Adam daha kürsüden inmeden zam haberleri peşpeşe geliyor.Bugün #elektrik muayene ve ilaç katkı payında olduğu gibi ,2019-09-30 22:32:15+00:00,#BeratAlbayrak #elektrik
3227,Imparator iki cümle kuruyor. Psgyi sahadan sileriz diyorsun. Kiymetini bilelim. Basin toplantisi ilac oldu valla.,2019-09-30 22:28:05+00:00,
3228,#Aysima Vatan için hizmet eden bir uzm.cvs.muzun kızı Ncl(beyincik erimesi) hastası Tedavisinin yapılabilmesi için yurtdışından ilaç alınması lazım 4000000lira gerekli Valilik izinli yardim kampanyası başlatılmıştır Lütfen yardımcı olalım. @karabey38 @haluklevent @fatihportakal,2019-09-30 22:27:21+00:00,#Aysima
3229,“Hira” Bebek için geç olmadan ilaç onayı verin @sagliklicozum @saglikbakanligi - Kampanyaya imza ver! http://chng.it/KfV8WPGy @UKChange aracılığıyla,2019-09-30 22:24:06+00:00,
3230,Baş ağrımı geçiren ilaç mideme zarar veriyor. Hayatımın formülü bu cümlede. Unsurlardan bağımsız cümlenin özündeki eylemlere bakın orada tam.,2019-09-30 22:23:11+00:00,
3231,“Hira” Bebek için geç olmadan ilaç onayı verin @sagliklicozum @saglikbakanligi - Kampanyaya imza ver! http://chng.it/W8zsv8yJ @UKChange aracılığıyla,2019-09-30 22:21:33+00:00,
3232,ama uyuması lazım en iyi ilaç uyku:(,2019-09-30 22:19:00+00:00,
3233,"""Mutluluğun iyi edemediğini iyileştirecek ilaç yoktur.""",2019-09-30 22:18:16+00:00,
3234,"Sesinin her tonu, günün her saati ilaç gibi.. Uyumadan önce duyduğum son sesin sana ait olması en büyük lütuf..",2019-09-30 22:16:43+00:00,
3235,4-5 gün önce doktor bi kaç ilaç vermişti az evvel aklıma geldi neyseki hatırladım hiç hatırlamayabilirdim de ,2019-09-30 22:13:41+00:00,
3236,En iyi ilaç uyku ,2019-09-30 22:13:01+00:00,
3237,"Yüzüme gülen yarama hiç ilaç olmaz, her birini tanıyorum sırtımdan",2019-09-30 22:12:02+00:00,
3238,Bilider o ilaç şizofren tedavisinde de uygulanıyor balici gibi gezdiğim günleri unutamıyorum...,2019-09-30 22:11:35+00:00,
3239,Ölülerin oy kullandığı ülke oldu Türkiy. Ölülerin tedavi oldu ilaç kullandığı ülke oldu Türkiye Vekilin hizmetcisine tecavüz ettiği ülke oldu Türkiye. Cocuklara tecavüz edilen ülke oldu Türkiye.Kadınların öldürüldüğü ülke oldu Türkiye hepsi AKP sayesinde. ,2019-09-30 22:11:05+00:00,
3240,"eşim tip-1 diyabet 10 yaşından beri. kan ölçüm çubukları (IME-DC), insulin iğnesi (ilaç değil, ucundaki iğne) için fark, kan ölçüm için kullanılan iğne ücretini tamamen cebinden ödüyor. her reçetede ödediği fark tutarı 200tl üstünde. raporu olduğunu yazmama gerek var mı bilmem.",2019-09-30 22:08:50+00:00,
3241,Zaman herşeyin ilacıysa sikeyim eczaneleri şuan ilaç oldun ,2019-09-30 22:06:34+00:00,
3242,Kışın pahali diye yakamadigimiz doğalgaz kullanamadığımız elektrik devletimize ilaç hastalık ve hastane masrafi olarak geri donecektir.,2019-09-30 22:03:56+00:00,
3243,"Hahahah. Nir önceki gözlüktü zaten. Kolay olur demiştim. Bir ilaç çizmişim, efsti. Gelmiş bir de bilen kopya almıştır diyorsun...",2019-09-30 22:03:56+00:00,
3244,Diyetisyen dermatoloji dahiliye endokrinoloji hepsine gittim her şeye baktılar tiroidlerimde sıkıntı vardı ama ilaç kullanma dendi b12den tedavi gördüm yağsız normal diyet her türlü beslenmeyi denedim ama hep aynı sürekli omzumda sırtımda sivilce çanta takınca kan akıyor,2019-09-30 22:03:19+00:00,
3245,Bana da babam karışım yaptı...yemekhanede ki abla ilaç verdi iç kızım bunu bişeyin kalmaz dedi...kim sorarsa sa dr ben ,2019-09-30 22:00:29+00:00,
3246,Hastalanınca ilaç kullanmıyorum ama bu öğrenci hayatı beni kullandırmaya zorluyor full dersim var yarınn ah ulen.,2019-09-30 22:00:21+00:00,
3247,Şuan en etkili uyku ilacım sensin ama o ilaç bana artık zehir...,2019-09-30 21:59:42+00:00,
3248,"İnsanın yanında; ilaç gibi insanlar olmalı, ağrılarını dindiren, yan etkisi olmayan. La Edri #ErkanMeriç https://twitter.com/SaniyeCakir7/status/1178763546190065664/photo/1",2019-09-30 21:57:11+00:00,#ErkanMeri
3249,Sabaha birşey kalmaz zaman her daim ilaç vazifesi görmüştür...,2019-09-30 21:55:58+00:00,
3250,170 adet hisse analizi yaptım yarın bunu kullanalımda derdımize derman olsun dıye yazacagım kesın bır ilac bulamadım takipte olacagım #isfin#vestl#bjkas#euhol#selec#ızfas#ccola,2019-09-30 21:50:10+00:00,
3251,Bir aydır sürünüyorum kullanmadığım ilaç kalmadı. İspanyol doktorlarla kanki oldum faceten falan ekliyorlar artık beni,2019-09-30 21:45:31+00:00,
3252,"İlaç firmaları teknoloji şirketleriyle kapışıyor, ilaç pazarının boyutu inanılmaz",2019-09-30 21:44:50+00:00,
3253,"Ayakta durmakta dahi zorlanıyordum. Psikolojim alt üst, bir kamyon ilaç yemiş ve bir fayda görmemişim. Belli ki teşhis yanlış. Tıp fakültesinde ""hoca"" olan hanımefendinin önüne masaya serdik ne kadar sonuç varsa..",2019-09-30 21:36:21+00:00,
3254,Ahh ülkemin eczaneleri... tutturabildigine satıyor ilaçları.. hangi ilaç ne kadar yazmıyor fişe..,2019-09-30 21:35:32+00:00,
3255,"Başı, beli, dizi veya vücutta başka bir yerinde kronik ağrıları olanlar avuç avuç ilaç içerler ama bunlardan zerre kadar fayda görmedikleri gibi bir de ilaçların yan etkilerine maruz kalırlar. http://ahmetrasimkucukusta.com/2019/09/30/yazilar/tip-yazilari/beslenme/kronik-agrilari-yok-eden-20-beslenme-tavsiyesi/",2019-09-30 21:29:11+00:00,
3256,manitanın çantasında ella diye bi ilaç gördüm hay allah üşüttü herhalde kıyamam,2019-09-30 21:26:24+00:00,
3257,Benim hayır diyemeyisime ilâç olur belkim,2019-09-30 21:23:29+00:00,
3258,"#AklınaGelseydim Bilge bir doktor; En iyi ilaç ""ilgi ve sevgi"" olduğunu söylemiş. Ya işe yaramazsa"" diye sorulmuş. Gülümsemiş ve şöyle yanıt vermiş; ""O Zaman Dozu Arttırın...",2019-09-30 21:22:55+00:00,#Akl
3259,Zaman ilaç değil zaman çürütücü,2019-09-30 21:22:53+00:00,
3260,Kimin içkisine ilaç atim ?,2019-09-30 21:20:42+00:00,
3261,"Daha az ilaç, daha az sağlık hizmeti, daha çok vergi, kendi cebinden emeklilik! Evrensel Yazarı Bülent Falakaoğlu, ‘Yeni Ekonomi Programı’nı yazdı: IMF’ye selam, işsizliğe devam ",2019-09-30 21:20:09+00:00,
3262,Bir doz ilaç 56 bin euro! Minik Meryem her geçen eriyor https://haberglobal.com.tr/yasam/manisa-da-yasayan-minik-meryem-gunden-gune-eriyor-8038,2019-09-30 21:18:38+00:00,
3263,Oh beee ilaç gibi geldi bu bi saattir kevaşenin birinin vidyosu dönüyor sinirim zıplamıştı ... ,2019-09-30 21:17:39+00:00,
3264,Grip oldum ama ne ilaç içiyorum ne kendime bakıyorum sadece bu gribin bana bulaştığı gibi geçip gitmesini bekliyorum,2019-09-30 21:16:06+00:00,
3265,ilaç içmeden iyileşme inadımı nasıl bırakırım lakin sürünüyorum ama yine de ilaç almıyorum,2019-09-30 21:15:34+00:00,
3266,17 Aralık itibari ile geçerli olacak ilaç fiyatları serverlarımıza konulmuştur. Online işlemler bölümünden yükleyebilirsiniz.(Ara Liste 1),2019-09-30 21:06:38+00:00,
